date,title,body,url,image,source,ticker
2025-02-09 11:11:00+00:00,"Strong Cryptocurrency Investments For $5,000 In 2025: Which Should You Choose - Solana or Panshibi for Maximum Gains?","If you have $5,000 and want to invest in crypto this year, Panshibi and Solana should be at the top of your list. The latest Solana news reports that the project might experience a slow but upward spike in value this year.",https://techbullion.com/strong-cryptocurrency-investments-for-5000-in-2025-which-should-you-choose-solana-or-panshibi-for-maximum-gains/,https://techbullion.com/wp-content/uploads/2025/02/Screenshot-2025-02-09-144743.jpg,TechBullion,SOL
2025-02-09 11:30:00+00:00,"1 Unstoppable Cryptocurrency to Buy Before It Soars 3,800%, According to Cathie Wood","That idea was somewhat legitimized last year, when the U.S. Securities and Exchange Commission approved dozens of Bitcoin exchange-traded funds (ETFs). These allow financial advisors and institutional investors to buy the cryptocurrency in a safe, regulated manner.",https://www.msn.com/en-us/money/savingandinvesting/1-unstoppable-cryptocurrency-to-buy-before-it-soars-3800-according-to-cathie-wood/ar-AA1yGHXV,https://g.foolcdn.com/editorial/images/806726/a-gold-coin-with-the-bitcoin-symbol-on-its-face.jpg,The Motley Fool on MSN.com,
2025-02-09 11:55:00+00:00,"Solana Price Prediction: How High Can SOL, RTX & XMR Climb By 2027?","In an era where digital assets and decentralized finance are transforming traditional financial systems, investors and crypto enthusiasts alike have begun to look beyond the usual suspects. The ongoing evolution of blockchain technology has sparked an exciting debate: how high can SOL,",https://techbullion.com/solana-price-prediction-how-high-can-sol-rtx-xmr-climb-by-2027/,https://techbullion.com/wp-content/uploads/2025/02/Screenshot-2025-02-09-145639.jpg,Impacts,SOL
2025-02-09 12:30:00+00:00,"Solana Price Reclaims $200, Even As Outflows Reach 18-Month High","Solana reclaims $200 despite surging outflows. Can SOL break $221 for a recovery, or will bearish pressure push it below $183?",https://beincrypto.com/solana-price-reclaims-support-despite-high-outflows/,,BeInCrypto,SOL
2025-02-09 14:02:00+00:00,What is Phantom? A Guide to Solana's Most Popular Crypto Wallet,"Phantom offers seamless access to DeFi, NFTs, and multi-chain swaps in one easy-to-use app. Here's how it works.",https://decrypt.co/resources/what-is-phantom-a-guide-to-solanas-most-popular-crypto-wallet,https://cdn.decrypt.co/resize/1024/height/512/wp-content/uploads/2025/02/phantom-wallet-gID_1-pID_4.png,Decrypt,SOL
2025-02-09 14:02:41+00:00,Bitcoin's role as a reserve asset gains traction in US as states adopt,"The 16th US Bitcoin reserve bill ignited hopes of a potential Bitcoin accumulation race that may reach global scales, despite volatility concerns.",https://www.msn.com/en-us/money/markets/bitcoin-s-role-as-a-reserve-asset-gains-traction-in-us-as-states-adopt/ar-AA1yHjdV,,Cointelegraph.com on MSN.com,
2025-02-10 00:23:00+00:00,Solana Ranch School PTO hosts popular Sweetheart Ball,Solana Ranch Elementary School PTO (Parent Teacher Organization) presented its Sweetheart Ball Feb. 1 at Lomas Santa Fe Country Club in Solana Beach. Families and some school staff and district,https://www.sandiegouniontribune.com/2025/02/09/solana-ranch-school-pto-hosts-popular-sweetheart-ball/,https://www.sandiegouniontribune.com/wp-content/uploads/2025/02/DMT-L-SBALL-014.jpg?w=1024&h=682,The San Diego Union-Tribune,SOL
2025-02-10 04:04:00+00:00,3 Reasons Lightchain AI Makes More Sense in Your Portfolio Than Ethereum (ETH) or Solana (SOL) in 2025,"As 2025 approaches, investors are looking for high-growth opportunities, and Lightchain AI is proving to be a stronger portfolio choice than Ethereum (ETH) or",https://www.msn.com/en-us/technology/artificial-intelligence/3-reasons-lightchain-ai-makes-more-sense-in-your-portfolio-than-ethereum-eth-or-solana-sol-in-2025/ar-AA1yIKGT,,Cryptopolitan on MSN.com,SOL
2025-02-10 05:52:00+00:00,This Altcoin Taking On Solana (SOL) in 2025 Could Surge 9700% During the Next Bull Run,"As the market prepares for its next bull run, a new competitor is developing aimed at one of the leading players in the crypto market: Solana (SOL). Solana has been a main player in the crypto space,",https://techbullion.com/this-altcoin-taking-on-solana-sol-in-2025-could-surge-9700-during-the-next-bull-run/,,Impacts,SOL
2025-02-10 06:10:00+00:00,Brace Yourself for DTX Exchange to Hit $10 in 2026 - Expert Calls $0.16 Price Better Upside Than Solana,"Price targets in crypto always spark debate, but some projections stand out. Calling DTX Exchange at $10 from just $0.16 is a bold statement, especially when compared to Solana's $520 outlook. But in a market where early entries see the biggest gains,",https://techbullion.com/brace-yourself-for-dtx-exchange-to-hit-10-in-2026-expert-calls-0-16-price-better-upside-than-solana/,https://techbullion.com/wp-content/uploads/2025/02/Screenshot-2025-02-10-100851.jpg,Impacts,SOL
2025-02-10 06:22:47+00:00,Bitcoin Pepe price outlook: can it surpass Solana's growth?,"Bitcoin Pepe's presale launches on February 11, bringing a Layer 2 solution that combines Bitcoin's security with Solana's speed.",https://www.msn.com/en-us/money/other/bitcoin-pepe-price-outlook-can-it-surpass-solana-s-growth/ar-AA1yJhE3,https://ik.imagekit.io/invezz/uploads/2025/02/chris-liverani-dBI_My696Rk-unsplash-1024x768.jpg,Invezz on MSN.com,SOL
2025-02-10 08:57:00+00:00,This Altcoin Looks Set to Continue Outperforming Solana and Cardano after Price Rises Over 200% This Year,Traders love speed and hype but also prize tokens that solve real problems and this is what makes Remittix stand out.,https://www.coinspeaker.com/this-altcoin-continue-outperforming-solana-cardano-price-rises-over-200-this-year/,,Coinspeaker,SOL
2025-02-10 09:15:00+00:00,"$2,000,000 Hit and Soaring: 1Fuel (OFT) Milestone Scores Thousands of Solana, Shiba Inu & PEPE Investors Globally","With the bullish sentiment surrounding 1Fuel flying around, investors are rushing to grab the last bit of the asset in Phase 3.",https://www.coinspeaker.com/2000000-hit-1fuel-oft-milestone-scores-thousands-solana-shiba-inu-pepe-investors/,,Coinspeaker,SOL
2025-02-10 09:30:00+00:00,"Solana Sees First Major Inflow in February, Aims To Stay Above $200","Solana sees a $16M spot inflow, signaling a bullish comeback. Can SOL hold above $200 and rally to $258? Read the analysis.",https://beincrypto.com/solana-inflows-first-in-february/,,BeInCrypto,SOL
2025-02-10 09:30:00+00:00,"This is Saquon Barkley, the great asset of the Eagles in the Super Bowl: humble, total athlete, and cryptocurrency investor","The running back is the star of Philadelphia, has accumulated over 2,000 yards in the regular season, has won the Offensive Player of the Year award, and threatens the Chiefs' Mahomes throne. Without Saquon Barkley,",https://www.msn.com/en-us/sports/football/this-is-saquon-barkley-the-great-asset-of-the-eagles-in-the-super-bowl-humble-total-athlete-and-cryptocurrency-investor/ar-AA1yJBuS,https://img-s-msn-com.akamaized.net/tenant/amp/entityid/AA1yJzmj.img?w=646&h=432&m=4&q=74,MSN,
2025-02-10 09:33:00+00:00,"Crypto Whales Are Scooping Up These 3 Altcoins As The Market Dips: Solana, Remittix, and AVAX","This PayFi protocol has been on a relentless upward trajectory. When several top altcoins suffered during the market meltdown, Remittix price has consistently pushed higher",https://blockonomi.com/crypto-whales-are-scooping-up-these-3-altcoins-as-the-market-dips-solana-remittix-and-avax/,https://blockonomi.com/wp-content/uploads/2025/02/Picture1-15.png,blockonomi,SOL
2025-02-10 09:50:00+00:00,"Central African Republic Launches Solana Meme Coin CAR, Trader Mints $12M","The Central African Republic (CAR) launched its Solana-based meme coin $CAR, aiming to leverage the global meme coin trend.",https://www.coinspeaker.com/central-african-republic-launches-solana-meme-coin-car-trader-mints-12m/,,Coinspeaker,SOL
2025-02-10 09:57:00+00:00,Solana's Decline and Ozak AI's Promising Surge: What This Means for Your Portfolio,Ozak AI is a blockchain-based crypto project that provides a technology platform that specializes in predictive AI and advanced data analytics for financial markets.,https://blockonomi.com/solanas-decline-and-ozak-ais-promising-surge-what-this-means-for-your-portfolio/,https://blockonomi.com/wp-content/uploads/2025/02/Picture1-35.jpg,Blockonomi,SOL
2025-02-10 10:15:00+00:00,"Solana Total Value Locked Shatters $8,600,000,000 in Q4 2024, Surging 486% in One Year: Messari","Ethereum (ETH) rival Solana (SOL) skyrocketed several multiples in terms of total value locked (TVL) in the last quarter of 2024, Messari's latest data shows.",https://dailyhodl.com/2025/02/10/solana-total-value-locked-shatters-8600000000-in-q4-2024-surging-486-in-one-year-messari/,https://dailyhodl.com/wp-content/uploads/2024/04/Solana-Hungry-for-New.jpg,The Daily Hodl,SOL
2025-02-10 10:16:00+00:00,"Whales Accumulate 520M XRP Along With This AI Coin, Solana Forms Hidden Divergence Pattern","Crypto whales are stacking up 520 million XRP while also eyeing a high-potential AI coin. Meanwhile, Solana forms a hidden divergence pattern—could a major breakout be next?",https://blockonomi.com/whales-accumulate-520m-xrp-along-with-this-ai-coin-solana-forms-hidden-divergence-pattern/,https://blockonomi.com/wp-content/uploads/2025/02/Picture1-39.jpg,Blockonomi,SOL
2025-02-10 10:56:00+00:00,VanEck Predicts Solana at $520—Will Ozak AI Be the Next AI-Powered Crypto to Surge Like SOL?,"The cryptocurrency industry has always been filled with exotic price predictions. A global investment firm, VanEck has made a price target of Solana at $520 by the end of 2025. If this becomes true, this would propel Solana's market cap to an estimated $250 billion,",https://techbullion.com/vaneck-predicts-solana-at-520-will-ozak-ai-be-the-next-ai-powered-crypto-to-surge-like-sol/,,Impacts,SOL
2025-02-10 11:00:00+00:00,Want to Light Your Solana Investment on Fire and Lose It All? Do This 1 Thing Right Now.,"The saddest part about investors losing their hard-earned Solana to presale and ICO grifts and scams is that they're already holding a vastly superior investment. Solana itself is far from a sleepy coin with minimal volume and a nascent development team. Its market cap is more than $90 billion, and as of Feb. 6, its 24-hour volume was $3.8 billion.",https://www.fool.com/investing/2025/02/10/want-to-light-your-solana-investment-on-fire-and-l/,https://g.foolcdn.com/editorial/images/806792/group-of-businesspeople-looking-frustrated-at-a-desk.jpg,The Motley Fool,SOL
2025-02-10 11:04:24+00:00,Thane tax consultant duped of Rs 8.66 lakh in cryptocurrency fraud,"A case has been registered against ten individuals for allegedly duping a 38-year-old tax consultant from Maharashtra's Thane district by luring him into investing in a digital asset with promises of high returns,",https://www.msn.com/en-in/autos/news/thane-tax-consultant-duped-of-rs-866-lakh-in-cryptocurrency-fraud/ar-AA1yITqS,https://img-s-msn-com.akamaized.net/tenant/amp/entityid/AA1yIOqb.img?w=1280&h=720&m=4&q=74,Mid-Day on MSN.com,
2025-02-10 12:00:00+00:00,"Got $1,000? Should You Buy XRP Right Now or Solana?","XRP (CRYPTO: XRP) and Solana (CRYPTO: SOL) are a pair of cryptocurrencies that are in their prime, and there are ample reasons to invest in both. XRP's claim to fame is that it offers snappy transaction speeds and rock-bottom gas (user) fees for international money transfers,",https://www.msn.com/en-us/money/savingandinvesting/got-1000-should-you-buy-xrp-right-now-or-solana/ar-AA1yJOpS,,The Motley Fool on MSN.com,SOL
2025-02-10 12:06:00+00:00,XRP and Solana Sprint Towards Historic ETF Approvals,"As the crypto market matures, XRP (XRP-USD) and Solana (SOL-USD) are leading the charge toward securing exchange-traded funds (ETFs) approvals.",https://markets.businessinsider.com/news/stocks/xrp-and-solana-sprint-towards-historic-etf-approvals-1034334792,https://blog.tipranks.com/wp-content/uploads/2025/02/Screenshot-2025-02-10-at-17.30.47-1024x449.png?utm_source=markets.businessinsider.com&utm_medium=referral,Markets Insider,SOL
2025-02-10 12:30:00+00:00,Top Crypto Gems to Buy: Qubetics Investors Eye Massive ROI While Solana's Staking Rewards Rise and SUI Strengthens Its Network,"Ever wondered which top crypto gems to buy are making waves and could be your next big investment? Solana and SUI have been in the spotlight for their innovative approaches to blockchain technology. Solana boasts high-speed transactions and a growing ecosystem,",https://techbullion.com/top-crypto-gems-to-buy-qubetics-investors-eye-massive-roi-while-solanas-staking-rewards-rise-and-sui-strengthens-its-network/,https://techbullion.com/wp-content/uploads/2025/02/fi-55-1000x600.jpg,Impacts,SOL
2025-02-10 12:34:41+00:00,Is Solana's Growth Being Held Back By A Technical Bottleneck?,"Solana's (CRYPTO: SOL) rapid growth faces a significant obstacle, according to Mert Mumtaz, Co-Founder and CEO of Helius Labs.",https://www.msn.com/en-us/money/smallbusiness/is-solanas-growth-being-held-back-by-a-technical-bottleneck/ar-AA1yKx1x,https://cdn.benzinga.com/files/images/story/2025/02/10/Solana-Chases-All-Time-Highs-With-8-Gain.jpeg?width=1200&height=800&fit=crop,Benzinga on MSN.com,SOL
2025-02-10 13:17:00+00:00,Solana Analyst Identifies an Under the Radar Altcoin That Could Outperform SOL in 2025,"In crypto, finding the next breakout altcoin is the difference between making small gains and life-changing wealth. Solana (SOL) was once a hidden gem, trading under $1 before skyrocketing to over $250,",https://techbullion.com/solana-analyst-identifies-an-under-the-radar-altcoin-that-could-outperform-sol-in-2025-2/,https://techbullion.com/wp-content/uploads/2025/02/Screenshot-2025-02-10-171641.jpg,TechBullion,SOL
2025-02-10 13:31:00+00:00,MEXC expands web3 ecosystem with Solayer (LAYER) listing: enhancing security and efficiency on Solana,"MEXC introduces Solayer (LAYER) listing to boost Solana's web3 security and efficiency, offering diverse reward programs.",https://cryptobriefing.com/mexc-solayer-listing-solana/,https://static.cryptobriefing.com/wp-content/uploads/2025/02/10074755/6e5ab010-b9f3-47d7-a182-5e28db427dc7-800x420.jpg,Crypto Briefing,SOL
2025-02-10 13:55:00+00:00,"Cathie Wood of Ark Investment says, this cryptocurrency could soar by 3800% and lists several catalysts for further upside; here's why","Bitcoin's current market value is $1.9 trillion, making up more than half of the cryptocurrency market. According to Cathie Wood, Bitcoin's future could rival traditional assets like gold.",https://www.msn.com/en-in/money/topstories/cathie-wood-of-ark-investment-says-this-cryptocurrency-could-soar-by-3800-and-lists-several-catalysts-for-further-upside-here-s-why/ar-AA1yKGwM,https://img-s-msn-com.akamaized.net/tenant/amp/entityid/AA1yKBNo.img?w=1200&h=900&m=4&q=100,MSN,
2025-02-10 14:03:00+00:00,Solana Bags Massive Spot Inflow as SOL Eyes Rebound,Solana recorded intense inflow in the spot market after weeks of bearish drawdown and high volatility that kept prices down.,https://www.coinspeaker.com/solana-bags-massive-spot-inflow-sol-eyes-rebound/,,Coinspeaker,SOL
2025-02-10 14:29:00+00:00,"Solana Price Outlook: Is the ""Ethereum Killer"" Living Up to Its Promise? Better For Our Environment","Solana is known as the ""Ethereum Killer"" but is it living up to its promise — and is the cryptocurrency better for our environment?",https://www.msn.com/en-us/money/other/solana-price-outlook-is-the-ethereum-killer-living-up-to-its-promise-better-for-our-environment/ar-AA1yKJM5,https://img-s-msn-com.akamaized.net/tenant/amp/entityid/AA1yKUZI.img?w=1200&h=624&m=4&q=74,MSN,SOL
2025-02-10 15:01:00+00:00,Solana layer-2 protocol Solaxy raises $19m in trending crypto presale,New Solana scaling solution Solaxy (SOLX) has raised $19 million in its ongoing presale. The layer-2 protocol is designed to ease congestion on Solana's network by handling transactions off-chain - a method used by Ethereum-based solutions like Arbitrum and Optimism.,https://cointelegraph.com/market-releases/solana-layer-2-protocol-solaxy-raises-19m-in-trending-crypto-presale,"https://images.cointelegraph.com/cdn-cgi/image/format=auto,onerror=redirect,quality=90,width=1200/https://s3.cointelegraph.com/storage/uploads/view/c86b78e2930f7acf771a7eb7d627e844.jpg",Cointelegraph,SOL
2025-02-10 15:10:00+00:00,Best Cryptocurrency Exchanges for Easy and Secure Crypto Trading in 2025,"As 2025 begins, many seek safe and efficient crypto trading. This guide covers top exchanges with spot, futures, fiat access, and no-KYC options.",https://insidebitcoins.com/news/best-cryptocurrency-exchanges-for-easy-and-secure-crypto-trading-in-2025,,Inside Bitcoins,
2025-02-10 17:23:00+00:00,"Reliance Jio Coin: Is it a cryptocurrency or reward token, know the details here","Mukesh Ambani-led Jio Platforms has partnered with internet technology company Polygon Labs. Social media users are excitedly discussing its new venture, Reliance Jio Coin. They are sharing screenshots online.",https://www.msn.com/en-in/money/other/reliance-jio-coin-is-it-a-cryptocurrency-or-reward-token-know-the-details-here/ar-AA1yLd16,https://img-s-msn-com.akamaized.net/tenant/amp/entityid/AA1yLd0o.img?w=800&h=576&m=4&q=55,MSN,
2025-02-10 17:25:00+00:00,Trump Solana Meme Coin Sinks Lower as Bitcoin and Dogecoin Hold Steady,"President Trump's Solana meme coin hit a low price not seen since just after launch, while other top assets remain relatively steady.",https://decrypt.co/305250/trump-solana-meme-coin-sinks-bitcoin-dogecoin-steady,https://cdn.decrypt.co/resize/1024/height/512/wp-content/uploads/2024/05/Donald-Trump_shutterstock_2430067439-gID_7.jpg,Decrypt,SOL
2025-02-10 18:15:00+00:00,"Cryptocurrency Price Today (February 10): Bitcoin Dips Below $97,000, Litecoin Becomes Top Gainer","Bitcoin price stood at $96,991.94, registering a 24-hour gain of 0.14 percent, as per CoinMarketCap. According to Indian exchanges, BTC price stood at Rs 85.09 lakh. ETH price stood at $2,634 marking a 24-hour loss of 0.86 percent at the time of writing. Ethereum price in India stood at Rs 2.31 lakh.",https://news.abplive.com/business/crypto/crypto-price-today-february-10-check-global-market-cap-bitcoin-btc-ethereum-doge-solana-litecoin-ftt-ena-live-tv-1750412,https://feeds.abplive.com/onecms/images/uploaded-images/2024/07/11/34addda0a934c1b3444afac7b05258d81720674074076402_original.jpg?impolicy=abp_cdn&imwidth=1200,abp LIVE,
2025-02-10 18:55:00+00:00,Rise of cryptocurrency loans in Australia spark concerns about financial 'contagion',"Cryptocurrencies are notoriously volatile and some economists say they have no intrinsic value, but that hasn't stopped some lenders from offering loans if Bitcoin or Ethereum are used as collateral.",https://www.abc.net.au/news/2025-02-11/cryptocurrency-loans-bitcoin-ethereum-collateral-risk-australia/104918046,https://live-production.wcms.abc-cdn.net.au/f8ed8d5ca772ecbe098e3c2672a3ba09?impolicy=wcms_watermark_news&cropH=2019&cropW=3590&xPos=0&yPos=0&width=862&height=485&imformat=generic,Australian Broadcasting Corporation,
2025-02-10 19:18:00+00:00,Solana Continues to Surge with 5 Million New Addresses: Is SOL on Track for New Peaks?,"The Solana blockchain continues to experience rapid growth, recently hitting a major milestone with 5 million new addresses created daily, according to data",https://www.crypto-news-flash.com/solana-continues-to-surge-with-5-million-new-addresses-is-sol-on-track-for-new-peaks/,https://www.crypto-news-flash.com/wp-content/uploads/2024/09/solana.jpg,Crypto News Flash,SOL
2025-02-10 19:21:00+00:00,"Why Bitcoin Outperformed Solana, Ethereum In Last Week's Flash Crash","Bitcoin (CRYPTO: BTC) has notably outperformed altcoins and meme coins over the recent weeks, according to a new report by on-chain data provider Nansen. What Happened: In the market analysis published on Feb.",https://www.msn.com/en-us/money/other/why-bitcoin-outperformed-solana-ethereum-in-last-week-s-flash-crash/ar-AA1yLD0E,https://img-s-msn-com.akamaized.net/tenant/amp/entityid/AA1yLQ7B.img?w=1024&h=576&m=4&q=67,MSN,SOL
2025-02-10 20:03:00+00:00,"hich Altcoin Has The Most Upside? XRP, DTX, And Solana Go Head To Head In 2025","The crypto market is slowly stabilizing after bearish trends, and investors are eyeing the altcoins with maximum potential. Analysts believe that Ripple (XRP) and the Solana price might gain momentum in 2025 while DTX is entering the market as a new competitor.",https://techbullion.com/hich-altcoin-has-the-most-upside-xrp-dtx-and-solana-go-head-to-head-in-2025/,https://techbullion.com/wp-content/uploads/2025/02/Screenshot-2025-02-11-000136.jpg,TechBullion,SOL
