date,title,body,url,image,source,ticker
2025-02-03 15:30:00+00:00,"Better Cryptocurrency to Buy With $1,000 Right Now: Dogecoin vs. Shiba Inu","There's a very good chance that Dogecoin will still be an important cryptocurrency 10 years from now, as it has already survived longer than anything else in its asset class. There's no substitute for its vintage, and Shiba Inu, while also highly likely to stick around, will simply never have the same set of distinctions as its older peer.",https://www.msn.com/en-us/money/topstocks/better-cryptocurrency-to-buy-with-1000-right-now-dogecoin-vs-shiba-inu/ar-AA1ykSvV,https://g.foolcdn.com/editorial/images/805777/investor-considers-laptop-with-notebook.jpg,The Motley Fool on MSN.com,DOGE
2025-02-03 16:10:27+00:00,"Why Bitcoin, Ethereum, and Dogecoin Crashed This Weekend","Cryptocurrencies like Bitcoin and Ethereum have been seen as inflation hedges, but that hasn't been the reality. In 2022 when inflation spiked, cryptocurrencies crashed in value.",https://www.msn.com/en-us/money/topstocks/why-bitcoin-ethereum-and-dogecoin-crashed-this-weekend/ar-AA1ykTDH,https://g.foolcdn.com/editorial/images/806237/crypto-trading-on-tablet.jpg,The Motley Fool on MSN.com,DOGE
2025-02-04 04:24:00+00:00,Dogecoin Regains Momentum After 'Black Sunday' Rout—Here's What Indicators Signal About The Memecoin's Next Moves,"Popular dog-themed cryptocurrency Dogecoin DOGE/USD resumed its uptrend Monday, igniting a strong wave of optimism among bulls. What happened: Dogecoin was up over 5% in the last 24 hours ...",https://www.benzinga.com/markets/cryptocurrency/25/02/43455908/dogecoin-regains-momentum-after-black-sunday-rout-heres-what-indicators-signal-about-the-memecoins-next-moves,,Benzinga.com,DOGE
2025-02-04 05:49:00+00:00,"Got $5,000? Better Cryptocurrency to Buy Right Now: Dogecoin vs. Solana","Solana is one of the most dynamic blockchains in use today. Dogecoin is the biggest meme coin, and it may get a new catalyst. Most investors should choose safer assets before riskier ones.",https://www.fool.com/investing/2025/02/04/got-5000-better-cryptocurrency-dogecoin-vs-solana/,,The Motley Fool,DOGE
2025-02-04 09:02:00+00:00,Dogecoin and Shiba Inu See Investor Exodus; Remittix Appears To Be Investors Hedge Against Market Crash,"As investors turn their backs on once-popular meme coins, the cryptocurrency market has experienced a dramatic change. The Dogecoin investor exodus is getting increasingly noticeable as whales sell off their substantial holdings in preparation for future drops.",https://techbullion.com/dogecoin-and-shiba-inu-see-investor-exodus-remittix-appears-to-be-investors-hedge-against-market-crash/,https://techbullion.com/wp-content/uploads/2025/02/Screenshot-2025-02-04-120446.jpg,Impacts,DOGE
2025-02-04 09:25:26+00:00,Dogecoin Regains Momentum After 'Black Sunday' Rout—Here's What Indicators Signal About The Memecoin's Next Moves,"Popular dog-themed cryptocurrency Dogecoin (CRYPTO: DOGE) resumed its uptrend Monday, igniting a strong wave of optimism among bulls.",https://www.msn.com/en-us/money/other/dogecoin-regains-momentum-after-black-sunday-rout-here-s-what-indicators-signal-about-the-memecoin-s-next-moves/ar-AA1ynxjc,https://cdn.benzinga.com/files/images/story/2025/02/04/Why-It-Matters.jpeg?width=1200&height=800&fit=crop,Benzinga.com on MSN.com,DOGE
2025-02-04 09:45:00+00:00,The Dogecoin Opportunity That Got Away—And How Arctic Pablo Coin is the Next Big Meme Coin Breakout,"Dogecoin launched as a joke—yes, a literal joke based on the Shiba Inu meme. Few took it seriously. It was just another fun cryptocurrency in an industry that was still in its infancy. But those who saw beyond the meme and leaped early Dogecoin investments are now sitting on life-changing profits.",https://blockonomi.com/the-dogecoin-opportunity-that-got-away-and-how-arctic-pablo-coin-is-the-next-big-meme-coin-breakout/,https://blockonomi.com/wp-content/uploads/2025/02/image1-8.png,blockonomi,DOGE
2025-02-04 10:35:00+00:00,1 Top Cryptocurrency Stock to Buy in 2025,"It could mean fewer legal challenges to deal with, and if cryptocurrency isn't such a hot-button issue, that could also help attract more institutional investors. Equally as important is that ...",https://www.fool.com/investing/2025/02/04/1-top-cryptocurrency-stock-to-buy-in-2025/,,The Motley Fool,
2025-02-04 10:49:00+00:00,"Got $5,000? Better Cryptocurrency to Buy Right Now: Dogecoin vs. Solana","Dogecoin (CRYPTO: DOGE) and Solana (CRYPTO: SOL) are both cryptocurrencies, but their similarities end there. Whereas one is a serious blockchain with a thriving ecosystem of different projects ...",https://www.nasdaq.com/articles/got-5000-better-cryptocurrency-buy-right-now-dogecoin-vs-solana,,Nasdaq,DOGE
2025-02-04 10:49:00+00:00,"Got $5,000? Better Cryptocurrency to Buy Right Now: Dogecoin vs. Solana","In contrast, Dogecoin has only picked up one new potential catalyst recently: It might be included in a meme coin exchange-traded fund (ETF). If such an ETF were approved, it'd bring more liquidity into Dogecoin, potentially causing the price to rise as people invested in it using capital in their traditional financial accounts.",https://www.msn.com/en-us/money/savingandinvesting/got-5000-better-cryptocurrency-to-buy-right-now-dogecoin-vs-solana/ar-AA1ynQvf,https://g.foolcdn.com/editorial/images/805792/investor-sitting-with-laptop-and-dog.jpg,The Motley Fool on MSN.com,DOGE
2025-02-04 12:00:00+00:00,"Best Altcoins to Buy Now: BlockDAG, Lido DAO & Dogecoin to Be The Biggest Crypto Breakouts in 2025","Market dips and volatility have created uncertainty, but for traders, they also present opportunities. With prices at lower levels, many investors are looking for the best altcoins to buy now, anticipating a rebound when momentum shifts.",https://techbullion.com/best-altcoins-to-buy-now-blockdag-lido-dao-dogecoin-to-be-the-biggest-crypto-breakouts-in-2025/,https://techbullion.com/wp-content/uploads/2025/02/unnamed-7.png,Impacts,DOGE
2025-02-04 12:09:00+00:00,"Billionaires Are Selling Nvidia and Buying a Cryptocurrency ETF That Some Wall Street Experts Think May Soar Up to 3,500%","Nvidia (NASDAQ: NVDA) has been one of the hottest tech stocks on the planet. In that time period, Nvidia rose more than 2,000%. It's the one stock that is most commonly associated with the artificial intelligence (AI) investment thesis,",https://www.msn.com/en-us/money/other/billionaires-are-selling-nvidia-and-buying-a-cryptocurrency-etf-that-some-wall-street-experts-think-may-soar-up-to-3-500/ar-AA1ynxx8,https://img-s-msn-com.akamaized.net/tenant/amp/entityid/AA1ynH7b.img?w=2186&h=1372&m=4&q=97,MSN,
2025-02-04 13:28:00+00:00,Why Is 1Fuel (OFT) Token Show Immense Tech Innovation & Can Elon Musk Dogecoin Ride Through Storms?,"Fuel (OFT) is redefining the crypto landscape with groundbreaking tech innovations, including seamless cross-chain transactions and advanced DeFi tools.",https://www.coinspeaker.com/why-1fuel-oft-token-immense-tech-innovation-can-dogecoin-ride-storms/,,coinspeaker,DOGE
2025-02-04 14:42:53+00:00,Dogecoin jumps 10% as Elon Musk warns Reddit trolls with federal action: 'Don't mess with DOGE',"Elon Musk's response to threats against employees associated with DOGE has fueled a surge in Dogecoin's value, pushing the token up by 10%. On Feb. 4, Musk, who leads the Department of Government Efficiency,",https://www.msn.com/en-us/news/us/dogecoin-jumps-10-as-elon-musk-warns-reddit-trolls-with-federal-action-don-t-mess-with-doge/ar-AA1yoTLW,https://img-s-msn-com.akamaized.net/tenant/amp/entityid/AA1yoTLt.img?w=740&h=416&m=4&q=79,invezz on MSN.com,DOGE
2025-02-04 15:00:00+00:00,Dogecoin leads way as most big cryptocurrencies post drops,"Most large cryptocurrencies were down during U.S. morning trading on Tuesday, with Dogecoin DOGEUSD -4.94% seeing the biggest move, tumbling 4.99% to 27 cents.",https://www.msn.com/en-us/money/markets/dogecoin-leads-way-as-most-big-cryptocurrencies-post-drops/ar-AA1yp10G,,MarketWatch on MSN.com,DOGE
2025-02-04 18:56:00+00:00,US Congress to form cryptocurrency working group,"U.S. Representative French Hill, a Republican who chairs the House Financial Services Committee, said on Tuesday lawmakers from both chambers of congress would form a working group to develop policy favoring development of digital assets.",https://www.aol.com/news/us-congress-form-cryptocurrency-working-195659459.html,https://media.zenfs.com/en/aol_reuters_29/f84160422faef086d93b105826afcefd,AOL,
2025-02-04 19:14:55+00:00,SEC is evaluating 'retroactive relief' for past coin offerings,"Before the election of Donald Trump, the SEC ""refused to use regulatory tools at its disposal and incessantly slammed on the enforcement breaks,"" said Peirce.",https://www.msn.com/en-us/money/financial-regulation/commissioner-peirce-says-sec-is-evaluating-retroactive-relief-for-past-coin-offerings/ar-AA1ypGYe,"https://images.cointelegraph.com/cdn-cgi/image/format=auto,onerror=redirect,quality=90,width=1200/https://s3.cointelegraph.com/uploads/2024-11/01930985-be5d-77c4-bdc5-291d8fd460eb",Cointelegraph.com on MSN.com,
2025-02-04 20:14:08+00:00,"Crypto Recovery: What to Make of Today's Moves in Bitcoin, Ethereum, and Dogecoin","Bitcoin, Ethereum, and Dogecoin have seen immense volatility in recent days, capped by a stronger performance on Tuesday as the market digests the macro environment. Ethereum's outperformance relative to Bitcoin and Dogecoin is notable,",https://www.msn.com/en-us/money/savingandinvesting/crypto-recovery-what-to-make-of-todays-moves-in-bitcoin-ethereum-and-dogecoin/ar-AA1ypWX1,https://g.foolcdn.com/editorial/images/806458/ether.jpg,The Motley Fool on MSN.com,DOGE
2025-02-04 22:45:00+00:00,Publicly Traded Firm Buys 1 Million Dogecoin to Augment Bitcoin Reserve,Canadian firm Neptune Digital Assets announced Tuesday that it bought a trove of Dogecoin alongside its growing corporate stash of Bitcoin.,https://decrypt.co/304421/publicly-traded-firm-buys-dogecoin-bitcoin-reserve,https://cdn.decrypt.co/resize/1024/height/512/wp-content/uploads/2023/11/shiba-inu-memecoin-1-gID_7.jpg,decrypt,DOGE
2025-02-05 03:08:00+00:00,Dogecoin trader says this emerging altcoin might be your best bet for outsized gains in 2025,"Dogecoin could continue its early February fall, leading investors to seek strong returns from RCO Finance's fast-growing altcoin.",https://coinjournal.net/news/dogecoin-trader-says-this-emerging-altcoin-might-be-your-best-bet-for-outsized-gains-in-2025/,https://coinjournal.net/wp-content/uploads/2025/02/dogecoin-vs-rco-finance.jpg,Internet of People,DOGE
2025-02-05 04:39:00+00:00,Could We See Dogecoin And Shiba Inu Prices Continue to Rise As We Take A Look Into New Sensation Remittix,There were brief moments last week where it seemed possible that both Shiba Inu and Dogecoin might see sustained rises. This theory has been put to bed in the,https://www.msn.com/en-us/money/other/could-we-see-dogecoin-and-shiba-inu-prices-continue-to-rise-as-we-take-a-look-into-new-sensation-remittix/ar-AA1yr25x,,cryptopolitan on MSN.com,DOGE
2025-02-05 05:27:00+00:00,Local 18-year-old helps develop Cryptocurrency website to teach beginners how to safely navigate it.,"As Cryptocurrencies, such as Bitcoin or Litecoin, become more popular in this digital age, one local home-school student is helping other students and new users learn the basics of Cryptocurrency trading.",https://www.msn.com/en-us/news/technology/local-18-year-old-helps-develop-cryptocurrency-website-to-teach-beginners-how-to-safely-navigate-it/ar-AA1yqmmW,,Waco-Temple-Bryan KWTX-TV on MSN.com,
2025-02-05 09:28:00+00:00,Cardano and Dogecoin Investors Look for the Next Big Bet - Could This Low-Cap Crypto Be the One?,Cardano and Dogecoin investors are hunting for the next big opportunity! Discover why this low-cap crypto could be the breakout token they've been waiting for.,https://blockonomi.com/cardano-and-dogecoin-investors-look-for-the-next-big-bet-could-this-low-cap-crypto-be-the-one/,,blockonomi,DOGE
2025-02-05 10:01:00+00:00,Meme Coin Slump: Shiba Inu (SHIB) and Dogecoin (DOGE) Tumbled - Experts Say This New DeFi Coin Might Be The Next Big King,"Shiba Inu (SHIB) and Dogecoin (DOGE) tumbled alongside the broader crypto market, although a bounce is unfolding; DTX, a new DeFi crypto, could soar as high as 100x this year.",https://blockonomi.com/meme-coin-slump-shiba-inu-shib-and-dogecoin-doge-tumbled-experts-say-this-new-defi-coin-might-be-the-next-big-king/,,blockonomi,DOGE
2025-02-05 10:08:00+00:00,Neptune Digital Assets Adds 1M Dogecoin (DOGE) to Corporate Treasury,"Canadian firms are diversifying their corporate treasuries with Dogecoin and other cryptocurrencies, as exemplified by Neptune Digital Assets' purchase of 1 million DOGE tokens",https://blockonomi.com/neptune-digital-assets-adds-1m-dogecoin-doge-to-corporate-treasury/,https://blockonomi.com/wp-content/uploads/2025/01/doge-2.jpg,blockonomi,DOGE
2025-02-05 11:30:56+00:00,Trump spooks Bitcoin: Why cryptocurrency prices are falling and what's next,"The cryptocurrency market has collapsed again under the influence of political decisions, including the price of Bitcoin. Total losses of investors are estimated at tens of billions of dollars. Read about why the cryptocurrency market collapsed,",https://www.msn.com/en-us/money/markets/trump-spooks-bitcoin-why-cryptocurrency-prices-are-falling-and-what-s-next/ar-AA1ys3N0,https://img-s-msn-com.akamaized.net/tenant/amp/entityid/AA1ys3MD.img?w=1300&h=820&m=4&q=79,RBC Ukraine on MSN.com,
2025-02-05 12:42:00+00:00,Will Dogecoin (DOGE) Price Rally $10 amid Recent Institutional Activity?,"Neptune Digital Assets disclosed acquiring 1,000,000 DOGE in late December at $0.37, however, Dogecoin price remained steady on this news.",https://www.coinspeaker.com/will-dogecoin-price-rally-10-recent-institutional-activity/,,coinspeaker,DOGE
2025-02-05 14:41:00+00:00,"Dogecoin to $13, Cardano to $16, or Rexas Finance (RXS) to $21 from $0.175: Which One is Achievable in 2025?",Rexas Finance's deliberate decision to eschew venture capital money and concentrate on community involvement highlights its dedication to decentralization.,https://www.msn.com/en-in/money/economy/dogecoin-to-13-cardano-to-16-or-rexas-finance-rxs-to-21-from-0-175-which-one-is-achievable-in-2025/ar-AA1ysOAp,https://img-s-msn-com.akamaized.net/tenant/amp/entityid/AA1ysMmN.img?w=1280&h=720&m=4&q=70,MSN,DOGE
2025-02-05 15:00:00+00:00,Why Are Dogecoin (DOGE) and Cardano (ADA) Holders Shifting to This ERC-20 Token?,"Yeti Ouro (YETIO), an ERC-20 token, could be the answer disillusioned DOGE and ADA holders have been waiting for.",https://www.coinspeaker.com/why-are-dogecoin-doge-and-cardano-ada-holders-shifting-this-erc-20-token/,,coinspeaker,DOGE
2025-02-05 16:34:00+00:00,"Is Dogecoin (DOGE) Set for Another Wild Rally, or Has Its Time Passed? 2 Coins That Could Step Up in Its Place","Dogecoin hovers near $0.35, balancing between key support levels and resistance at $0.3550. Trading volume dips as investors await clear signals, while",https://www.cryptopolitan.com/is-dogecoin-doge-set-for-another-wild-rally-or-has-its-time-passed-2-coins-that-could-step-up-in-its-place/,https://www.cryptopolitan.com/wp-content/uploads/2025/02/unnamed-25-2.jpg,cryptopolitan,DOGE
2025-02-05 18:54:00+00:00,"Why Cryptocurrencies Ethereum, Dogecoin, and Shiba Inu Are Rising Today","As of 1:10 p.m. ET today, the price of Ethereum ( ETH -4.21%), the world's second-largest cryptocurrency, traded 4.2% higher from late afternoon yesterday. Meanwhile, the price of the meme tokens Dogecoin ( DOGE -6.13%) and Shiba Inu ( SHIB -1.52%) traded 1.7% and 5.1% higher, respectively.",https://www.fool.com/investing/2025/02/05/why-cryptocurrencies-ethereum-dogecoin-and-shiba-i/,https://g.foolcdn.com/editorial/images/806585/positive-person-1.jpg,The Motley Fool,DOGE
2025-02-05 20:00:00+00:00,"Missed Dogecoin's 2021 Rally? This AI Altcoin Could Skyrocket 14,750% Before Q3 2025","IntelMarkets attracts DOGE whales after forming a similar Dogecoin price pattern in 2021. Memecoin analysts predict up to 14,750% gains for INTL before Q3 in 2025.",https://blockonomi.com/missed-dogecoins-2021-rally-this-ai-altcoin-could-skyrocket-14750-before-q3-2025/,https://blockonomi.com/wp-content/uploads/2025/02/Picture1-17.jpg,blockonomi,DOGE
2025-02-06 00:13:00+00:00,Buy & Hold Dogecoin (DOGE) or Ripple (XRP) in February 2025? DeepSeek AI Answers,"Although both cryptocurrencies have advantages, more analysts contend that an upcoming initiative called Rexas Finance (RXS) might be even more profitable.",https://www.coinspeaker.com/buy-hold-dogecoin-or-ripple-in-february/,"https://www.coinspeaker.com/cdn-cgi/imagedelivery/-BqQuoxiOfYhg62js8a7lQ/cc9b83fa-e44f-4966-ddac-d86ea34b1200/w=1024,h=683",coinspeaker,DOGE
2025-02-06 00:17:00+00:00,Pepe Coin Price Prediction: Will PEPE Capitalize on the Hype from Grayscale's Dogecoin Trust and Surge 5x in February?,"With Grayscale's Dogecoin Trust launch, meme leaders like Pepe Coin may start trending once again in 2025 - a topic we'll explore further below. However, there are also other projects that could start gaining attention,",https://www.coinspeaker.com/will-pepe-capitalize-on-the-hype-from-grayscales-dogecoin-trust-and-surge-5x/,"https://www.coinspeaker.com/cdn-cgi/imagedelivery/-BqQuoxiOfYhg62js8a7lQ/2143d9ca-14e7-43d0-a7b3-6b0bf7e5e900/w=1024,h=683",coinspeaker,DOGE
2025-02-06 00:24:00+00:00,"Bitcoin approaches $100,000 as Trump's pro-crypto policies take shape","Despite Bitcoin topping $100,000 this week, the world's largest cryptocurrency has slipped below that critical threshold again, and is currently trading at a price near $97,200.",https://www.thestreet.com/crypto/markets/bitcoin-approaches-100000-as-trumps-pro-crypto-policies-take-shape,,TheStreet.com,
2025-02-06 06:11:00+00:00,Dogecoin price flashes death cross signal as Elon Musk grills US Treasury,Dogecoin price stabilized around the $0.26 level on Wednesday amid a 22% weekly decline as crypto markets tumbled further. Elon Musk's latest 'DOGE' tweets amid an ongoing face-off with the ...,https://www.fxstreet.com/cryptocurrencies/news/dogecoin-price-flashes-death-cross-signal-as-elon-musk-grills-us-treasury-202502060612,,FXStreet,DOGE
2025-02-06 08:33:00+00:00,Dogecoin News: DOGE Price Drops despite Grayscale Launching Dogecoin Fund and Filing for ETF,"If you're looking for an altcoin that bridges crypto with real-world banking, visit Remittix before presale tokens sell out.",https://www.coinspeaker.com/dogecoin-news-doge-price-drops-grayscale-dogecoin-fund-filing-etf/,https://www.coinspeaker.com/wp-content/uploads/2025/02/dogecoin-news-doge-price-drops-grayscale-dogecoin-fund-filing-etf.jpg,coinspeaker,DOGE
2025-02-06 09:08:00+00:00,"Shiba Inu and Dogecoin Battle for Meme Coin Dominance, But This New Token Might Yield the Most Gains In February","Shiba Inu and Dogecoin fight for meme coin dominance, but a new token is grabbing attention. Analysts say it could deliver the biggest gains in February—discover why.",https://blockonomi.com/shiba-inu-and-dogecoin-battle-for-meme-coin-dominance-but-this-new-token-might-yield-the-most-gains-in-february/,https://blockonomi.com/wp-content/uploads/2025/02/Picture1-19.jpg,blockonomi,DOGE
2025-02-06 11:15:00+00:00,New AI Crypto Steals The Spotlight From Dogecoin (DOGE) and Cardano (ADA) - How High Can It Go?,"IntelMarkets' intriguing blend of AI and DeFi and unique AI-powered trading platform sets the stage for huge gains, potentially outshining Dogecoin and Cardano.",https://www.cryptopolitan.com/new-ai-crypto-steals-the-spotlight-from-dogecoin-doge-and-cardano-ada-how-high-can-it-go/,https://www.cryptopolitan.com/wp-content/uploads/2025/02/unnamed-1-5.png,cryptopolitan,DOGE
2025-02-06 12:31:00+00:00,Meme Coin Market Falls 14% as DTX Is Poised To Beat Dogecoin And Floki Inu,"As meme coins like Dogecoin (DOGE) and Floki Inu (FLOKI) face steep declines—down 31% and 50% this month—traders are highlighting new opportunities. Analysts believe DTX Exchange (DTX) could redefine crypto trading with its hybrid platform,",https://techbullion.com/meme-coin-market-falls-14-as-dtx-is-poised-to-beat-dogecoin-and-floki-inu/,,Impacts,DOGE
2025-02-06 13:00:00+00:00,Shift From Memes to AI: Whales Dump Their Shiba Inu (SHIB) and Dogecoin (DOGE) Bags For This New AI Crypto,"IntelMarket's bullish AI narrative captures whale interest, sparking a shift from Shiba Inu (SHIB) and Dogecoin (DOGE); it is tipped for a 75x rally post-launch.",https://blockonomi.com/shift-from-memes-to-ai-whales-dump-their-shiba-inu-shib-and-dogecoin-doge-bags-for-this-new-ai-crypto/,https://blockonomi.com/wp-content/uploads/2025/02/Picture1-22.jpg,blockonomi,DOGE
2025-02-06 15:33:00+00:00,"Dogecoin News and Price Prediction, Remittix ICO Past $10M, What Is All Hype About?","Remittix is built on modern blockchain technologies, which ensures that transactions are both fast and secure.",https://www.coinspeaker.com/dogecoin-news-price-prediction-remittix-past-10m-ico-what-is-all-hype-about/,"https://www.coinspeaker.com/cdn-cgi/imagedelivery/-BqQuoxiOfYhg62js8a7lQ/3f6a71a2-9c03-47d0-c0b8-902b85e9a200/w=1024,h=683",coinspeaker,DOGE
2025-02-06 16:02:00+00:00,Dogecoin Whales Buy The Dip: Traders Predict New Highs After 22% Pullback,"Despite a 21.6% decline over the past seven days, Dogecoin (CRYPTO: DOGE) whales and traders remain bullish, expecting a strong recovery. What Happened: Crypto trader Master Kenobi compared Dogecoin's current price action to 2017 rather than 2021,",https://www.msn.com/en-us/technology/cryptocurrencies/dogecoin-whales-buy-the-dip-traders-predict-new-highs-after-22-pullback/ar-AA1yxgLT,https://img-s-msn-com.akamaized.net/tenant/amp/entityid/AA1yxuux.img?w=983&h=553&m=4&q=67,MSN,DOGE
2025-02-06 17:13:00+00:00,From Dogecoin Memes to Serious Gains: Skyren DAO's User-Friendly Interface Welcomes Crypto Novices,"Skyren DAO makes DeFi simple for beginners. With an easy-to-use interface, automated rewards, and no technical barriers, it's a gateway for crypto novices looking to earn.",https://www.coinspeaker.com/skyren-daos-user-friendly-interface-welcomes-crypto-novices/,,coinspeaker,DOGE
2025-02-06 18:17:00+00:00,Is Cryptocurrency the Future of Tourism in the Finger Lakes?,"Where tourism is concerned, it's important for payment methods to be easy to access, safe, and offer global transactions - all of which can be found with crypto. More tourist hotspots are now accepting a variety of payment methods including cryptocurrencies,",https://www.fingerlakes1.com/2025/02/06/is-cryptocurrency-the-future-of-tourism-in-the-finger-lakes/,,fingerlakes1,
2025-02-06 18:28:00+00:00,"Dogecoin, XRP and Cardano Down 26% as Bitcoin Sinks Again",Three of the top coins have shed a quarter of their respective value in the last week as Bitcoin struggles amid Trump's trade war.,https://decrypt.co/304737/dogecoin-xrp-cardano-down-bad-bitcoin-sinks,https://cdn.decrypt.co/resize/1024/height/512/wp-content/uploads/2023/01/crypto-dogecoin-market-gID_7.jpg,decrypt,DOGE
2025-02-06 19:44:00+00:00,SEC Officials Instructed to Shrink Cryptocurrency Enforcement Team: Report,The U.S. Securities and Exchange Commission (SEC) is reportedly downsizing a special unit of more than 50 lawyers and staff members tasked to bring crypto enforcement actions.,https://dailyhodl.com/2025/02/06/sec-officials-instructed-to-halt-cryptocurrency-enforcement-actions-report/,https://dailyhodl.com/wp-content/uploads/2025/02/to-halt-actions.jpg?w=750&h=375&crop=1,The Daily Hodl,
2025-02-06 20:13:00+00:00,Dogecoin and Shiba Fall as Meme Coin Market Cap Drops Below $70b - A Buy Opportunity?,"Meanwhile, the undisputed leader of the category, Dogecoin (DOGE) has experienced year-to-date losses of -21.6% while the popular Pepe the Frog token (PEPE), whose gains exceeded 1,500% in 2024 ...",https://www.fxempire.com/forecasts/article/dogecoin-and-shiba-fall-as-meme-coin-market-cap-drops-below-70b-a-buy-opportunity-1496041,,FXEmpire.com,DOGE
2025-02-06 23:05:00+00:00,Dogecoin whales buy 750 million DOGE as analyst predicts 200% surge,"Dogecoin whales have accumulated 750 million DOGE amid a market dip, signaling strong confidence in a potential rally.",https://www.msn.com/en-us/money/economy/dogecoin-whales-buy-750-million-doge-as-analyst-predicts-200-surge/ar-AA1yy8C9,,Crypto on The Street on MSN.com,DOGE
2025-02-07 00:59:00+00:00,"Over Dogecoin and Shiba Inu, RCO Finance Will Set a New Record Rising 50,000% in 2025","Dogecoin and Shiba Inu slip while RCO Finance eyes a 50,000% surge in 2025, promising the next big crypto breakout.",https://blockonomi.com/over-dogecoin-and-shiba-inu-rco-finance-will-set-a-new-record-rising-50000-in-2025/,https://blockonomi.com/wp-content/uploads/2025/02/Picture1-24.jpg,blockonomi,DOGE
2025-02-07 02:00:00+00:00,Dogecoin (DOGE) Price Struggles to Gain Momentum As Trading Volume Falls 36%,DOGE price struggles below $0.33 as bearish signals persist. Weak momentum and key resistance levels limit upside potential.,https://beincrypto.com/doge-price-struggles-trading-volume-down/,,https//beincrypto.com,DOGE
2025-02-07 08:01:00+00:00,Why XRP and Dogecoin Investors Are Turning to This Crypto Presale for 2025 Gains,"Mutuum Finance (MUTM), a decentralized liquidity protocol, has captured market attention during its Phase 1 presale. The project has already raised $72,000 from 189 holders, with tokens priced at $0.01—a rate expected to surge 600% to $0.",https://blockonomi.com/why-xrp-and-dogecoin-investors-are-turning-to-this-crypto-presale-for-2025-gains/,https://blockonomi.com/wp-content/uploads/2025/02/image2-9.png,blockonomi,DOGE
