date,title,body,url,image,source,ticker
2025-02-07 09:03:00+00:00,"Best Meme Coins To Buy Now For Quick 100x Returns - Floki Inu, Dogecoin and New Crypto Presale Bullionaire","If you've been in the crypto space for even a minute, you know that meme coins have a history of making overnight millionaires. Dogecoin started as a joke and turned into a multi-billion-dollar asset.",https://techbullion.com/best-meme-coins-to-buy-now-for-quick-100x-returns-floki-inu-dogecoin-and-new-crypto-presale-bullionaire/,https://techbullion.com/wp-content/uploads/2025/02/Screenshot-2025-02-07-134946-2.jpg,Impacts,DOGE
2025-02-07 09:13:00+00:00,Dogecoin (DOGE) Price: Structure Shows Striking Similarities to Pre-2017 Rally Period,"Technical analysis reveals similarities between Dogecoin's current price patterns and those observed during the 2017 bull run, with the cryptocurrency currently trading at $0.26 following established support and resistance levels.",https://blockonomi.com/dogecoin-doge-price-structure-shows-striking-similarities-to-pre-2017-rally-period/,https://blockonomi.com/wp-content/uploads/2024/12/doge-coin.jpg,blockonomi,DOGE
2025-02-07 10:00:00+00:00,Which Will Hit $1 First? Dogecoin Price Prediction vs New Trending Crypto Meme Panshibi,"Panshibi's presale plans to raise $10m within 60 days and judging from what it is offering, it is definitely possible.",https://www.coinspeaker.com/which-will-hit-1-first-dogecoin-price-prediction-trending-crypto-meme-panshibi/,"https://www.coinspeaker.com/cdn-cgi/imagedelivery/-BqQuoxiOfYhg62js8a7lQ/19110d6c-7531-41da-aa6f-970e0f601d00/w=1024,h=683",coinspeaker,DOGE
2025-02-07 10:28:00+00:00,Dogecoin (DOGE) Price Stabilizes at $0.264 Following 20% Weekly Decline,Dogecoin trades at $0.264 in a consolidation pattern with a potential short squeeze brewing at $0.272 while 77% of traders maintain bullish positions.,https://blockonomi.com/dogecoin-doge-price-stabilizes-at-0-264-following-20-weekly-decline/,https://blockonomi.com/wp-content/uploads/2025/01/doge.jpg,blockonomi,DOGE
2025-02-07 11:24:00+00:00,"Dogecoin Price Analysis: Market Strategist Says Pump To $0.4 Is Imminent, Introduces Impressive Crypto Token For 30,400% Gains","The Dogecoin price is set for a major pump to $0.4, while WallitIQ (WLTQ) is set to deliver up to 30,400% for investors in its ongoing presale.",https://blockonomi.com/dogecoin-price-analysis-market-strategist-says-pump-to-0-4-is-imminent-introduces-impressive-crypto-token-for-30400-gains/,,blockonomi,DOGE
2025-02-07 11:45:00+00:00,"Trump's World Liberty Financial Buys More Crypto, Why This Sub $1 Altcoin Is Next Dogecoin","As the crypto market continues to evolve, Trump's World Liberty Financial has made headlines with its latest crypto acquisition. This bold move by World Liberty Financial has fueled speculation about which asset might be next on their radar,",https://techbullion.com/trumps-world-liberty-financial-buys-more-crypto-why-this-sub-1-altcoin-is-next-dogecoin/,,Impacts,DOGE
2025-02-07 13:00:00+00:00,"Solana and Dogecoin Lose Key Levels, Possibility of Lower Prices See Investors Hedge with This New Crypto","With a 7% drop, the past month has been mostly bearish, however many in the community are still somewhat hopeful about Solana's near-term direction. Though Solana is more than 30% behind its all-time high of $294, analysts anticipate the altcoin may retest this level not too far off.",https://www.coinspeaker.com/solana-dogecoin-lose-key-levels-possibility-lower-prices-investors-hedge-crypto/,,coinspeaker,DOGE
2025-02-07 13:20:00+00:00,What's next for Tampa's hurricane-battered Beer Can Island? Cryptocurrency.,"When Pine Key reopens, owners plan to accept payment for drinks, concert tickets and more using a new meme coin.",https://www.msn.com/en-us/news/us/what-s-next-for-tampa-s-hurricane-battered-beer-can-island-cryptocurrency/ar-AA1yAQhP,https://www.tampabay.com/resizer/v2/4SIPF3TFHBB25PDZQHYQ64OA2U.jpg?auth=d6bca256bf12e78b7a971a5fcb721b182d3fcbd26058d9b44f619268518e862e&height=675&width=1200&smart=true,Tampa Bay Times on MSN.com,
2025-02-07 13:51:00+00:00,"1 Cryptocurrency to Consider Buying With $1,500, and 1 to Avoid","Even if you only have $1,500 on hand to invest in the cryptocurrency sector, it behooves you to deploy your capital judiciously rather than frivolously. With so many cryptocurrency opportunities abounding right now -- including quite a few opportunities to lose all of your money -- sticking to the highest-quality assets is simply not optional.",https://www.fool.com/investing/2025/02/07/1-cryptocurrency-to-consider-buying-with-1500/,https://g.foolcdn.com/editorial/images/806610/three-pleased-investors-crowd-around-a-laptop.jpg,The Motley Fool,
2025-02-07 14:58:00+00:00,"Next Cryptocurrency to Explode, 7 February — Berachain, APENFT, ai16z, TRON","Uncover the next cryptocurrency to explode shortly. Using the latest market data, discover what makes the tokens in our list promising.",https://insidebitcoins.com/news/next-cryptocurrency-to-explode-7-february-berachain-apenft-ai16z-tron,,Inside Bitcoins,
2025-02-07 16:00:00+00:00,A New Cryptocurrency to Buy Before the Price Rises 100% in February 2025,"Mutuum Finance (MUTM) has emerged as a noteworthy cryptocurrency for investors looking to enter the market at an early stage. With its decentralized lending and borrowing platform, the project focuses on practical use cases in the DeFi space,",https://www.msn.com/en-us/money/other/a-new-cryptocurrency-to-buy-before-the-price-rises-100-in-february-2025/ar-AA1yBEUh,https://img-s-msn-com.akamaized.net/tenant/amp/entityid/AA1yBCrl.img?w=1456&h=816&m=4&q=89,Cryptopolitan on MSN.com,
2025-02-07 16:31:14+00:00,"Why Cryptocurrencies Ethereum, XRP, and Dogecoin Are Trading Higher Today","Cryptocurrencies moved higher today after a somewhat perplexing jobs report this morning that ultimately led to a slight increase in Treasury yields. Bitcoin, the world's largest cryptocurrency, hovered around $98,",https://www.msn.com/en-us/money/markets/why-cryptocurrencies-ethereum-xrp-and-dogecoin-are-trading-higher-today/ar-AA1yBCQr,,The Motley Fool on MSN.com,DOGE
2025-02-07 19:21:12+00:00,"Dogecoin Eyes $2 While Shiba Inu Burn Rate Surges 1,151%—Is a Rally Coming?","Dogecoin (CRYPTO: DOGE) and Shiba Inu (CRYPTO: SHIB) continue to trade sideways, but traders maintain that more upside is still to come for the underperforming meme coins. Cryptocurrency Price Market Cap 24-Hour Trend 7-Day Trend Dogecoin (CRYPTO: DOGE) $0.",https://www.msn.com/en-us/money/news/dogecoin-eyes-2-while-shiba-inu-burn-rate-surges-1151-is-a-rally-coming/ar-AA1yCghy,https://img-s-msn-com.akamaized.net/tenant/amp/entityid/AA1yCght.img?w=1024&h=576&m=4&q=67,Benzinga on MSN.com,DOGE
2025-02-07 19:30:00+00:00,This Token Will Outperform Dogecoin (DOGE) and Shiba Inu (SHIB) with a 23114% Mega Pump in 2025,A new cryptocurrency project called Rexas Finance (RXS) aims to revolutionize the current market dynamics of digital assets. Market observers predict Rexas,https://www.cryptopolitan.com/this-token-will-outperform-dogecoin-doge-and-shiba-inu-shib-with-a-23114-mega-pump-in-2025/,,cryptopolitan,DOGE
2025-02-07 19:36:00+00:00,Hawk Tuah girl reveals her 'biggest mistake' after cryptocurrency scandal,"The internet sensation, also known as Haliey Welch, has addressed her cryptocurrency controversy in a 'leaked' podcast episode and declared how bad she feels for those who invested",https://www.msn.com/en-gb/entertainment/celebrities/hawk-tuah-girl-reveals-her-biggest-mistake-after-cryptocurrency-scandal/ar-AA1yC590,https://img-s-msn-com.akamaized.net/tenant/amp/entityid/AA1yC9BR.img?w=810&h=539&m=4&q=79,MSN,
2025-02-07 21:45:00+00:00,Lebanon man sentenced to 20 years for stealing $37 million in cryptocurrency,"A 21-year-old from Lebanon, Indiana, will serve 20 years in federal prison for his involvement in stealing $37 million in cryptocurrency.",https://www.indystar.com/story/news/crime/2025/02/07/lebanon-sentenced-20-years-cyber-crime-evan-frederick-light-37-million-crypto-currency-south-dakota/78339785007/,,The Indianapolis Star,
2025-02-08 07:41:00+00:00,"Best 3 Meme Coins for 2025 Gains: Bullionaire's Presale Has A Strong Start, Dogecoin & Shiba Inu","Meme coins have become one of the most profitable sectors in crypto, and as 2025 approaches, investors are looking for the best tokens to add to their portfolios. While Dogecoin (DOGE) and Shiba Inu (SHIB) remain iconic in the space,",https://techbullion.com/best-3-meme-coins-for-2025-gains-bullionaires-presale-has-a-strong-start-dogecoin-shiba-inu/,,Impacts,DOGE
2025-02-08 08:45:00+00:00,"Forget Dogecoin and Shiba Inu, Investors Are Racing To The Crypto Tipped To Become The Next XRP","Dogecoin and Shiba Inu have basked in meme coin fame over the past few years, but their golden eras appear to be ebbing away. Investors are seemingly losing interest in speculative meme coin assets. Many are chasing deep utility instead,",https://www.msn.com/en-us/technology/cryptocurrencies/forget-dogecoin-and-shiba-inu-investors-are-racing-to-the-crypto-tipped-to-become-the-next-xrp/ar-AA1yDGAi,https://img-s-msn-com.akamaized.net/tenant/amp/entityid/AA1yDQoN.img?w=1600&h=1067&m=4&q=89,MSN,DOGE
2025-02-08 10:01:00+00:00,"Better Cryptocurrency to Buy With $2,000 and Hold for 5 Years: XRP vs. Ethereum","XRP (XRP 0.81%) and Ethereum (ETH -4.72%) are two of the biggest cryptocurrencies, yet their focuses are very different. XRP aims to rapidly and accurately process money transfers",https://www.msn.com/en-us/money/savingandinvesting/better-cryptocurrency-to-buy-with-2000-and-hold-for-5-years-xrp-vs-ethereum/ar-AA1yDYyh,https://g.foolcdn.com/editorial/images/806561/investors-discuss-investment-at-table.jpg,The Motley Fool on MSN.com,
2025-02-08 10:40:00+00:00,🤑 Dogecoin & XRP Investors Agree: These 5 Altcoins Could Skyrocket Next! 💰,Crypto enthusiasts are buzzing about a fresh surge in the market. Dogecoin and XRP advocates have pinpointed several altcoins with promising potential. Solana,https://www.cryptopolitan.com/🤑-dogecoin-xrp-investors-agree-these-5-altcoins-could-skyrocket-next-💰/,,cryptopolitan,DOGE
2025-02-08 13:00:00+00:00,"Dogecoin Eyes Recovery After 25% Crash, but Investor Confidence Fades","Dogecoin drops 25% as bearish sentiment grows. Can it reclaim $0.268 and rally, or will weak momentum keep DOGE struggling?",https://beincrypto.com/dogecoin-price-bearish-as-confidence-fades/,,https//beincrypto.com,DOGE
2025-02-08 14:04:00+00:00,Are Dogecoin and Bonk The Best Meme Coins To Buy On This Dip? Here's What Crypto Whales Are Buying,"Meme coins often deliver massive gains or heart-stopping drops and Dogecoin (DOGE) and Bonk (BONK) are no exceptions. Over the past month, DOGE has fallen 26.81% to $0.2509, while BONK plunged 41.21% to $0.",https://www.msn.com/en-us/technology/cryptocurrencies/are-dogecoin-and-bonk-the-best-meme-coins-to-buy-on-this-dip-here-s-what-crypto-whales-are-buying/ar-AA1yEp6K,,MSN,DOGE
2025-02-08 14:09:24+00:00,Dogecoin Price Prediction: Market Analysts Expect $1 In 2025; Rollblock Gaining Momentum,"Dogecoin is widely expected to hit the $1 mark in 2025, fueled by Elon Musk's continued support and speculation around a potential ETF approval. However, some analysts believe it could be outperformed by a new altcoin.",https://www.msn.com/en-us/health/fitness/dogecoin-price-prediction-market-analysts-expect-1-in-2025-rollblock-gaining-momentum/ar-AA1yErUl,https://img-s-msn-com.akamaized.net/tenant/amp/entityid/AA1yEAjp.img?w=800&h=450&m=4&q=100,Week99er on MSN.com,DOGE
2025-02-08 19:22:00+00:00,Earnings On Autopilot? BlockDAG's 5% USDT Referral Rewards Explained; Here's What Ripple & Dogecoin Market Momentum Reveals,"Dogecoin's market momentum is at a technical crossroads, with indicators hinting at a surge past $0.40. Some analysts expect a peak by February, while others see a longer buildup toward $1.25. Ripple,",https://techbullion.com/earnings-on-autopilot-blockdags-5-usdt-referral-rewards-explained-heres-what-ripple-dogecoin-market-momentum-reveals/,,Impacts,DOGE
2025-02-09 05:30:00+00:00,Experts Reveal Which Cryptocurrency Whales Are Targeting for 2025 Instead of Bitcoin or Ethereum,"While Bitcoin (BTC) and Ethereum (ETH) remain dominant in the crypto market, whales are starting to shift their focus toward high-growth alternatives with strong real-world utility. One project gaining traction is Mutuum Finance (MUTM),",https://www.msn.com/en-us/money/economy/experts-reveal-which-cryptocurrency-whales-are-targeting-for-2025-instead-of-bitcoin-or-ethereum/ar-AA1yG4Nb,https://img-s-msn-com.akamaized.net/tenant/amp/entityid/AA1yG9g9.img?w=1456&h=816&m=4&q=89,MSN,
2025-02-09 09:21:00+00:00,Company manager loses RM2.5mil to cryptocurrency scam,KUALA LUMPUR: A 42-year-old company manager has lost RM2.5mil after falling victim to a cryptocurrency investment scam.,https://www.thestar.com.my/news/nation/2025/02/09/company-manager-loses-rm25mil-to-cryptocurrency-scam,,The Star,
2025-02-09 09:32:00+00:00,Dramatic moment Spanish cops swoop on Brit kidnappers in cryptocurrency sting,Spanish police released footage showing the moment they surrounded a vehicle as the trio tried to flee - but moments later they were cuffed on the ground at gunpoint,https://www.mirror.co.uk/news/world-news/breaking-dramatic-moment-spanish-cops-34643004,,The Mirror,
2025-02-09 10:29:00+00:00,The Meme Coin Market Is Changing - Why Bullionaire's Presale Is Attracting Dogecoin & Floki Holders,"The meme coin market is undergoing a major shift, and the landscape that once belonged solely to Dogecoin (DOGE) and Floki (FLOKI) is now making room for new contenders with stronger market positioning.",https://techbullion.com/the-meme-coin-market-is-changing-why-bullionaires-presale-is-attracting-dogecoin-floki-holders/,https://techbullion.com/wp-content/uploads/2025/02/Screenshot-2025-02-09-152606-1.jpg,Impacts,DOGE
2025-02-09 10:33:00+00:00,Meme Coin Showdown: Can Bullionaire's Presale Hype Surpass FLOKI and Dogecoin's ROI in 2025?,"Crypto thrives on momentum. Dogecoin's rise, the biggest meme coin in history, wasn't about its fundamentals. FLOKI took that same playbook, adding branding and utility layers to sustain hype. Now, the next meme coin set to dominate is Bullionaire ($BULL),",https://techbullion.com/meme-coin-showdown-can-bullionaires-presale-hype-surpass-floki-and-dogecoins-roi-in-2025/,https://techbullion.com/wp-content/uploads/2025/02/Screenshot-2025-02-09-153223.jpg,Impacts,DOGE
2025-02-09 10:33:00+00:00,Three British men in Spain arrested over kidnap of cryptocurrency broker,"Three British men have been arrested following the kidnap of a cryptocurrency broker in Spain. The broker was taken hostage two weeks after a chance meeting in Marbella, on the Costa-del-Sol.",https://metro.co.uk/2025/02/09/three-british-men-spain-arrested-kidnap-cryptocurrency-broker-22523644/,,Metro,
2025-02-09 11:30:00+00:00,"1 Unstoppable Cryptocurrency to Buy Before It Soars 3,800%, According to Cathie Wood","Bitcoin (CRYPTO: BTC) has a market capitalization of about $1.9 trillion as of this writing. It represents more than half of the total value of all cryptocurrencies in circulation, which currently stands at $3.",https://www.msn.com/en-us/money/savingandinvesting/1-unstoppable-cryptocurrency-to-buy-before-it-soars-3800-according-to-cathie-wood/ar-AA1yGHXV,https://img-s-msn-com.akamaized.net/tenant/amp/entityid/AA1yGTxl.img?w=2128&h=1409&m=4&q=97,The Motley Fool on MSN.com,
2025-02-09 13:36:00+00:00,Panshibi Vs. Dogecoin Price Prediction: Which Coin Will 10x In 2025 And Why?,"Panshibi (SHIBI) and Dogecoin (DOGE) are two of the hottest meme coins, but only one has the potential for massive gains in 2025. While Dogecoin remains a strong name, Panshibi's explosive presale and innovative AI and social-fi features set it apart.",https://www.msn.com/en-us/money/technology/panshibi-vs-dogecoin-price-prediction-which-coin-will-10x-in-2025-and-why/ar-AA1yH1Qk,https://img-s-msn-com.akamaized.net/tenant/amp/entityid/AA1yH4oJ.img?w=1600&h=1067&m=4&q=100,MSN,DOGE
