date,title,body,url,image,source,ticker
2025-01-16 20:57:00+00:00,Trump Plans to Designate Cryptocurrency as a National Priority,"President-elect Donald Trump is planning to release an executive order elevating crypto as a policy priority and giving industry insiders a voice within his administration, according to people familiar with the plans.",https://www.bloomberg.com/news/articles/2025-01-16/trump-plans-to-designate-cryptocurrency-as-a-national-priority,,Bloomberg L.P.,
2025-01-18 00:00:00+00:00,"Trump Begins Selling New Crypto Token, Raising Ethical Concerns","President-elect Donald J. Trump and his family on Friday started selling a cryptocurrency token featuring an image of Mr. Trump drawn from the July assassination attempt, a potentially lucrative ...",https://www.nytimes.com/2025/01/18/us/politics/trump-meme-coin-crypto.html,,The New York Times,
2025-01-18 18:19:00+00:00,Trump mints $31 billion with new official $TRUMP crypto meme coin,"Just days before his second inauguration, President-elect Donald Trump issued a cryptocurrency meme coin memorializing his response to the July 2024 assassination ...",https://www.usatoday.com/story/money/2025/01/18/trump-meme-coin-price-crypto/77802704007/,,USA Today,
2025-01-19 00:00:00+00:00,Trump's Cryptocurrency Surges to Become One of the World's Most Valuable,By Eric Lipton and David Yaffe-Bellany Eric Lipton and David Yaffe-Bellany have been writing about the cryptocurrency industry for the last three years out of Washington and San Francisco.,https://www.nytimes.com/2025/01/19/us/politics/trump-cryptocurrency-surges.html,,The New York Times,
2025-01-19 15:59:00+00:00,How To Earn Passive Income With Cryptocurrency,Learn how to make your crypto work for you and earn passive income through various strategies in the digital asset space.,https://www.forbes.com/sites/digital-assets/article/how-to-earn-passive-income-cryptocurrency/,,Forbes,
2025-01-20 22:28:00+00:00,"Donald and Melania Trump debuted meme coins, $Trump and $Melania. Here's what to know.","President Trump, who has vowed to turn the U.S. into the cryptocurrency capital of the world, got a head start on those plans by debuting new his-and-her meme coins ...",https://www.cbsnews.com/news/donald-trump-melania-meme-coin-cryptocurrency-what-to-know/,,CBS News,
2025-01-21 12:22:00+00:00,Why Dogecoin Is Gaining Today,"Dogecoin is gaining today after its logo was included in the website for the Department of Government Efficiency. The Department of Government Efficiency is led by Elon Musk, who has been a vocal ...",https://www.fool.com/investing/2025/01/21/why-dogecoin-is-gaining-today/,,The Motley Fool,DOGE
2025-01-22 17:01:00+00:00,How to choose a cryptocurrency exchange—3 key tips for 2025,"With countless platforms vying for attention, finding a secure, efficient and innovative crypto exchange is essential for navigating the digital asset market in 2025",https://cointelegraph.com/news/how-to-choose-a-cryptocurrency-exchange3-key-tips-for-2025,,CoinTelegraph,
2025-01-22 19:29:00+00:00,Why Dogecoin Is Sinking Today,Dogecoin (CRYPTO: DOGE) is seeing a valuation pullback in Wednesday's trading. The cryptocurrency's token price was down 6.3% over the previous 24 hours as of 1:50 p.m. ET. Dogecoin posted gains ...,https://finance.yahoo.com/news/why-dogecoin-sinking-today-190843190.html,,Yahoo Finance,DOGE
2025-01-27 00:38:12+00:00,Why the Official Trump Cryptocurrency Is Plummeting This Week,"Official Trump's valuation is falling in conjunction with negative media coverage and reactions from some cryptocurrency investors and post-inauguration trading momentum. While the token is still up more than 360% from its debut, momentum has turned bearish following its post-launch surge.",https://www.msn.com/en-us/money/economy/why-the-official-trump-cryptocurrency-is-plummeting-this-week/ar-AA1xUaHW,,The Motley Fool on MSN.com,
2025-01-27 10:30:00+00:00,Does This New Bullish Tailwind for Dogecoin Make It a Buy?,"Dogecoin ( DOGE -11.91%) just got exposure to what might become a strong new tailwind. While it will take at least a few months for it to develop, it could provide the king of the meme coins with some additional liquidity, and that could send the price higher for quite some time, under the best of conditions.",https://www.msn.com/en-us/technology/cryptocurrencies/does-this-new-bullish-tailwind-for-dogecoin-make-it-a-buy/ar-AA1xVEQD,https://g.foolcdn.com/editorial/images/804983/investor-on-trading-floor.jpg,The Motley Fool on MSN.com,DOGE
2025-01-27 13:47:00+00:00,Trump's Crypto Executive Orders Drive $1.9B Inflows Into Cryptocurrency Investment Funds,Discover how Trump's crypto-related orders drove $1.9B inflows into cryptocurrency investment funds last week.,https://insidebitcoins.com/news/trumps-crypto-executive-orders-drive-1-9b-inflows-into-cryptocurrency-investment-funds,https://insidebitcoins.com/wp-content/uploads/2025/01/trump-7.jpg,Inside Bitcoins,
2025-01-27 22:25:00+00:00,Dogecoin Hits Lowest Price So Far in 2025 as Trump Meme Coin and Solana Stumble,"Dogecoin fell hard on Monday, dropping below $0.31 as Bitcoin, Solana, and other coins echoed the stock market's dive.",https://decrypt.co/303002/dogecoin-lowest-price-2025-trump-solana-stumble,https://cdn.decrypt.co/resize/1024/height/512/wp-content/uploads/2023/04/0_0-2-gID_7.png,decrypt,DOGE
2025-01-28 15:14:27+00:00,Dogecoin Up 3% After Monday Rout: Why Is DOGE Going Up?,"Dogecoin (CRYPTO: DOGE) continues to trade sideways, but analysts still see bullish potential for the meme coin in the medium term.",https://www.msn.com/en-us/money/economy/dogecoin-up-3-after-monday-rout-why-is-doge-going-up/ar-AA1y0CyX,https://cdn.benzinga.com/files/images/story/2025/01/28/Price-Action.jpeg?width=1200&height=800&fit=crop,Benzinga on MSN.com,DOGE
2025-01-28 15:22:08+00:00,"Cryptocurrency scams cost Texans the most in 2024, BBB says","According to BBB's data, in just two years, scam reports have doubled and losses increased by more than 430%. Cryptocurrency/investment scams were the costliest. ""$3.1 million out the door in 2024 from Texas residents due to an investment involving digital Bitcoin, digital currencies, cryptocurrencies,"" said Meza.",https://www.msn.com/en-us/money/economy/cryptocurrency-scams-cost-texans-the-most-in-2024-bbb-says/ar-AA1y0E4H,https://www.kxan.com/wp-content/uploads/sites/40/2025/01/GettyImages-1334805030.jpg?w=1280,KXAN Austin on MSN.com,
2025-01-28 16:11:00+00:00,What is a crypto task force? What to know about Trump's new cryptocurrency executive order,Trump's plans to create a more crypto-friendly government. He introduced a new task force. Here's what it could mean for crypto.,https://www.usatoday.com/story/money/2025/01/28/crypto-task-force-trump-executive-order/77993052007/,"https://www.usatoday.com/gcdn/authoring/authoring-images/2025/01/23/USAT/77910100007-20250121-t-083346-z-969206937-rc-2-ziba-2-jcb-2-rtrmadp-3-usatrumpcrypto.JPG?crop=4607,2593,x0,y239&width=3200&height=1802&format=pjpg&auto=webp",USA Today,
2025-01-28 17:32:00+00:00,SeaDream becomes first cruise line to accept cryptocurrency payments for all voyages,"Passengers can now book sailings to destinations such as the Caribbean and Mediterranean using bitcoin, ethereum and more than 200 other cryptocurrencies",https://www.aol.com/seadream-becomes-first-cruise-line-153310015.html,https://media.zenfs.com/en/aol_the_independent_us_877/cf15fdeeea54a1e79a1c284d0201db23,AOL,
2025-01-28 21:52:00+00:00,Dogecoin Open Interest Falls By $1.7 Billion as Original Meme Coin Sinks,Data from CoinGlass shows that open interest on the original meme coin now stands at nearly $3.8 billion. It hit a record high of $5.5 billion on January 17. Open interest refers to the collective value of futures contracts that have not yet been settled by traders.,https://decrypt.co/303202/dogecoin-open-interest-falls-1-7-billion,https://cdn.decrypt.co/resize/1024/height/512/wp-content/uploads/2021/07/dogecoin-trading-robinhood-gID_7.jpeg,decrypt,DOGE
2025-01-28 22:21:24+00:00,Bitwise files with SEC for spot Dogecoin ETF,"Bitwise registered a Dogecoin trust in Delaware earlier this month, but its latest filing makes its bid to launch a Dogecoin ETF official with the SEC. Bitwise has filed with the US Securities and Exchange Commission to list an exchange-traded fund (ETF) tracking the price of the popular memecoin Dogecoin.",https://www.msn.com/en-us/money/markets/bitwise-files-with-sec-for-spot-dogecoin-etf/ar-AA1y1CGo,"https://images.cointelegraph.com/cdn-cgi/image/format=auto,onerror=redirect,quality=90,width=1200/https://s3.cointelegraph.com/uploads/2025-01/0194aed2-8d20-75ed-bb36-2c6fbb9469ff",Cointelegraph.com on MSN.com,DOGE
2025-01-28 22:56:00+00:00,Bitwise Files for Dogecoin ETF Amid Shifting US Regulations,"A Dogecoin ETF could soon trade in the U.S. as Bitwise filed an application on Tuesday, following its registration of a trust last week.",https://decrypt.co/303214/bitwise-files-for-dogecoin-etf-amid-shifting-us-regulations,https://cdn.decrypt.co/resize/1024/height/512/wp-content/uploads/2021/08/dogecoin-dog-meme-coins-tokens-gID_7.jpg,decrypt,DOGE
2025-01-29 09:14:00+00:00,Could Dogecoin Reach $1 in 2025?,"Post-election buzz around cryptocurrency has propelled Dogecoin higher. The meme coin's supply mechanics create continuous downward price pressure. Competition from newer, alternative meme coins ...",https://www.fool.com/investing/2025/01/29/could-dogecoin-reach-1-in-2025/,,The Motley Fool,DOGE
2025-01-29 09:22:00+00:00,Should You Buy Dogecoin While It's Under $1?,"Dogecoin currently trades at just $0.35 per token, but with a series of potential tailwinds in the pipeline, could now be a good buying opportunity while it's still below the milestone price of $1?",https://www.msn.com/en-us/money/markets/should-you-buy-dogecoin-while-its-under-1/ar-AA1y2R0I,https://g.foolcdn.com/image/?url=https://g.foolcdn.com/editorial/images/805312/a-shiba-inu-dog-sitting-in-front-of-a-blank-chalk-board.jpg&op=resize&w=700,The Motley Fool on MSN.com,DOGE
2025-01-29 14:13:00+00:00,Could Dogecoin Reach $1 in 2025?,"Dogecoin (CRYPTO: DOGE), the popular meme coin, has rocketed to its highest price since 2021. Investors might wonder whether this potential new era for cryptocurrencies can push Dogecoin to new heights.",https://www.msn.com/en-us/money/savingandinvesting/could-dogecoin-reach-1-in-2025/ar-AA1y3R8S,https://img-s-msn-com.akamaized.net/tenant/amp/entityid/AA1y4092.img?w=4631&h=2547&m=4&q=80,The Motley Fool on MSN.com,DOGE
2025-01-29 15:00:00+00:00,Dogecoin leads way as most big cryptocurrencies post gains,"Most large cryptocurrencies were up during U.S. morning trading on Wednesday, with Dogecoin DOGEUSD +2.59% seeing the biggest move, rising 2.34% to 32 cents.",https://www.msn.com/en-us/money/markets/dogecoin-leads-way-as-most-big-cryptocurrencies-post-gains/ar-AA1y430f,https://images.mktw.net/im-397587?width=700&height=466,MarketWatch on MSN.com,DOGE
2025-01-29 21:05:04+00:00,Avoiding the next collapse: Study unveils the factors behind cryptocurrency exchange failures,"Imagine logging into your cryptocurrency exchange platform one morning only to find the website down, your funds gone, and no one to answer your questions. This nightmare has been a harsh reality for thousands of traders,",https://www.msn.com/en-us/money/other/avoiding-the-next-collapse-study-unveils-the-factors-behind-cryptocurrency-exchange-failures/ar-AA1y5454,https://img-s-msn-com.akamaized.net/tenant/amp/entityid/AA1y521c.img?w=1280&h=646&m=4&q=84,Phys.org on MSN.com,
2025-01-30 06:19:00+00:00,UFC's Instagram account hacked: Promotion confirms cryptocurrency post as fraudulent,"Wednesday evening, the Las Vegas-based MMA promotion's Instagram account displayed a bizzare cryptocurrency post, suggesting the UFC was launching a new coin. A promotion official quickly confirmed to MMA Junkie that the post is not legitimate and the account has been hacked.",https://mmajunkie.usatoday.com/2025/01/ufc-instagram-account-hacked-cryptocurrency-scam-post,https://mmajunkie.usatoday.com/wp-content/uploads/sites/91/2023/07/UFC-octagon-cage-fence-background.png?w=1024&h=576&crop=1,MMA Junkie,
2025-01-30 10:15:00+00:00,Nuclear power in North Tonawanda? Cryptocurrency operation shows interest,"Digihost, a cryptocurrency mining operation, said it may want to use small nuclear reactors to power its facility located off Erie Avenue in North Tonawanda.",https://buffalonews.com/news/local/digihost-cryptomining-north-tonawanda-fortistar-nuclear-power/article_5428cec0-de60-11ef-842e-6bb01d985fd6.html,"https://bloximages.chicago2.vip.townnews.com/buffalonews.com/content/tncms/assets/v3/editorial/5/42/5428cec0-de60-11ef-842e-6bb01d985fd6/679aa9f906052.preview.jpg?crop=1920,1008,0,35&resize=1200,630&order=crop,resize",Buffalo News,
2025-01-30 12:32:29+00:00,Dogecoin Sentiment Improves After ETF Application—When Will The 'Explosive' Move Come?,Dogecoin (CRYPTO: DOGE) has caught the interest of traders following the first application for a Dogecoin spot exchange-traded fund.,https://www.msn.com/en-us/money/other/dogecoin-sentiment-improves-after-etf-application-when-will-the-explosive-move-come/ar-AA1y7LKY,https://cdn.benzinga.com/files/images/story/2025/01/30/Dogecoin-Could-Surge-7185-In-2025--Top-A.jpeg?width=1200&height=800&fit=crop,Benzinga.com on MSN.com,DOGE
2025-01-30 19:45:00+00:00,Crypto Giant Bitwise Files for Spot Dogecoin (DOGE) ETF With SEC,Crypto asset management giant Bitwise is hoping to launch a spot exchange-traded fund (ETF) for Dogecoin (DOGE).,https://dailyhodl.com/2025/01/30/crypto-giant-bitwise-files-for-spot-dogecoin-doge-etf-with-sec/,https://dailyhodl.com/wp-content/uploads/2025/01/spot-dogecoin-etf.jpg,The Daily Hodl,DOGE
2025-01-31 00:00:00+00:00,Grayscale launched its Dogecoin Trust,"Adrian Zmudzinski is a cryptocurrency journalist with over 4,000 articles under his belt. His bylines include Cointelegraph, Benzinga, Crypto.News, and BeInCrypto. Leading crypto-focused asset ...",https://readwrite.com/grayscale-launched-its-dogecoin-trust/,,ReadWrite,DOGE
2025-01-31 03:05:00+00:00,Grayscale Unveils New Dogecoin Trust,"Grayscale has rolled out a new trust offering exposure to dogecoin (DOGE), the asset manager announced Friday. ""Dogecoin represents a paradigm shift in global financial accessibility ...",https://www.coindesk.com/business/2025/01/30/grayscale-unveils-new-dogecoin-trust,,CoinDesk,DOGE
2025-01-31 03:31:00+00:00,"Dogecoin Might 'Outperform' Bitcoin And Lead The Altcoin Season, Says Analyst","Dogecoin (CRYPTO: DOGE) corrected sharply this week, but the dog-themed cryptocurrency could gain upsides in the days to come, according to a popular trader's analysis on Thursday.",https://www.benzinga.com/25/01/43375192/dogecoin-has-lost-6-in-a-week-but-upward-momentum-possible-if-these-analyses-are-to-be-believed,https://cdn.benzinga.com/files/images/story/2025/01/30/Why-It-Matters_2.jpeg?width=1200&height=800&fit=crop,Benzinga.com,DOGE
2025-01-31 10:06:00+00:00,"Better Cryptocurrency to Buy With $1,000 Right Now: Solana vs. Shiba Inu","When comparing the outcome of investing in the primary token of a major blockchain like Solana (SOL -2.55%) or investing in a silly meme coin like Shiba Inu (SHIB -0.27%), the res",https://www.msn.com/en-us/money/markets/better-cryptocurrency-to-buy-with-1000-right-now-solana-vs-shiba-inu/ar-AA1yaChW,,The Motley Fool on MSN.com,
2025-01-31 14:56:09+00:00,"Grayscale backs dogecoin's potential, unveils new closed-end fund","Grayscale Investments has launched a new closed-end fund centered on Dogecoin ( DOGE-USD ), it said on Friday, signaling a strong belief in the cryptocurrency's transition from a memecoin to a means of promoting financial inclusion globally.",https://www.msn.com/en-us/money/markets/grayscale-backs-dogecoin-s-potential-unveils-new-closed-end-fund/ar-AA1ybCyo,https://static.seekingalpha.com/cdn/s3/uploads/getty_images/1351825546/image_1351825546.jpg?io=getty-c-w750,Seeking Alpha on MSN.com,DOGE
2025-01-31 15:34:00+00:00,Gulbit: Leading Cryptocurrency Exchange for Successful Trading in 2025,"In the world of cryptocurrencies, where competition grows stronger every day, Gulbit.com has long established itself a",https://www.msn.com/en-us/money/other/gulbit-leading-cryptocurrency-exchange-for-successful-trading-in-2025/ar-AA1ybHMI,https://img-s-msn-com.akamaized.net/tenant/amp/entityid/AA1ybTeS.img?w=1280&h=1011&m=4&q=83,MSN,
2025-01-31 15:49:00+00:00,Grayscale launches Dogecoin Trust—what it means for investors,"Grayscale Investments has announced the launch of a Dogecoin Trust fund, offering investors exposure to Dogecoin (DOGE).",https://www.msn.com/tr-tr/finans/piyasalar/grayscale-launches-dogecoin-trust-what-it-means-for-investors/ar-AA1ybZdG,https://ik.imagekit.io/invezz/uploads/2022/01/where-to-buy-dogecoin-it-is-rising-after-tesla-started-accepting-it-as-payment.jpg,invezz on MSN.com,DOGE
2025-01-31 16:03:00+00:00,Grayscale launches dogecoin-focused fund as altcoin adoption picks up pace,"(Reuters) - Grayscale Investments said on Friday it was launching an investment fund aimed at dogecoin, as the cryptocurrency asset manager looks to tap into the increasing momentum around ...",https://finance.yahoo.com/news/grayscale-launches-dogecoin-focused-fund-155953232.html,,Yahoo Finance,DOGE
2025-01-31 17:39:00+00:00,Grayscale Introduces Dogecoin Trust Amid ETF Expectations,"Grayscale unveils a Dogecoin Trust, expanding crypto ETFs as DOGE gains mainstream investment traction amid regulatory shifts.",https://beincrypto.com/grayscale-launches-dogecoin-trust/,,https//beincrypto.com,DOGE
2025-01-31 19:10:00+00:00,Dogecoin could rally following launch of Grayscale DOGE Trust,Grayscale announced the launch of a Grayscale Dogecoin Trust. The Trust offers customers exposure to DOGE's price movement and is only open to eligible investors. DOGE could rally as the Trust's ...,https://www.fxstreet.com/cryptocurrencies/news/dogecoin-could-rally-following-launch-of-grayscale-doge-trust-202501311910,,FXStreet,DOGE
2025-01-31 19:22:00+00:00,Gang who kidnapped man for cryptocurrency jailed,Gang members who kidnapped a man and forced him to handover hundreds of thousands of pounds worth of cryptocurrency have been jailed - after they were tracked down from DNA left on cigarette butts.,https://www.msn.com/en-us/news/crime/gang-who-kidnapped-man-for-cryptocurrency-jailed/ar-AA1ycgWR,https://media.zenfs.com/en/aol_bbc_articles_618/ed0ef6cc904e9b8092f15a4451f3d863,BBC on MSN.com,
2025-01-31 19:37:16+00:00,Grayscale Launches Dogecoin Trust,"Originally launched as a joke, Dogecoin's market cap is now nearing $50 billion and a pipeline of investment products to invest in it is beginning to grow.",https://www.msn.com/en-us/technology/cryptocurrencies/grayscale-launches-dogecoin-trust/ar-AA1ycuk5,,Investopedia on MSN.com,DOGE
2025-01-31 19:41:00+00:00,Crypto Investment Giant Grayscale Announces Launch of New Dogecoin (DOGE) Trust,Crypto asset management firm Grayscale is announcing the launch of a new trust that would give investors access to the popular meme asset Dogecoin (DOGE).,https://dailyhodl.com/2025/01/31/crypto-investment-giant-grayscale-announces-launch-of-new-dogecoin-doge-trust/,https://dailyhodl.com/wp-content/uploads/2023/08/DOGE-Could-Correct-Nearly.jpg,The Daily Hodl,DOGE
2025-01-31 20:18:00+00:00,Betting on Bitcoin? Here's what you need to know before you invest,"NYU finance professor David Yermack weighs in on the potential risks and benefits of investing in crypto and more specifically, Bitcoin.",https://www.msn.com/en-us/money/other/thinking-of-investing-in-crypto-expert-weighs-in-on-potential-benefits-risks/ar-AA1ybPfy,"https://kubrick.htvapps.com/vidthumb/images/bitcoin-thumbnail-v1-679bf922a5734.png?crop=1xw:1xh;center,top&resize=1200:*",WPTZ Plattsburgh-Burlington on MSN.com,
2025-01-31 20:41:38+00:00,Grayscale launches Dogecoin investment fund,"Asset manager Grayscale Investments has launched an investment fund for Dogecoin, the most popular memecoin by market cap.",https://www.msn.com/en-us/money/markets/grayscale-launches-dogecoin-investment-fund/ar-AA1ycJWw,"https://images.cointelegraph.com/cdn-cgi/image/format=auto,onerror=redirect,quality=90,width=1200/https://s3.cointelegraph.com/uploads/2025-01/0194bdff-ecbf-7c10-b526-032401867341",Cointelegraph.com on MSN.com,DOGE
2025-01-31 23:24:00+00:00,Grayscale Debuts New Dogecoin Trust—And Files to Convert It Into ETF,"Grayscale, known for its Bitcoin and Ethereum spot ETFs, has now launched a Dogecoin trust—and filed to convert it into a spot ETF.",https://decrypt.co/303843/bitcoin-and-ethereum-etf-issuer-grayscale-debuts-a-new-dogecoin-trust,https://cdn.decrypt.co/resize/1024/height/512/wp-content/uploads/2025/01/dogecoin-doge-shiba-inu-wall-street-conference-table-gID_7.png,decrypt,DOGE
2025-02-01 11:22:00+00:00,Better Meme Coin to Buy: Dogecoin vs. Official Trump,"Dogecoin is the meme coin that started its entire asset class within cryptocurrency, and many years later it's still alive and kicking, with an impressively large market cap of around $47 billion.",https://finance.yahoo.com/news/better-meme-coin-buy-dogecoin-111900743.html,,Yahoo Finance,DOGE
2025-02-02 11:26:00+00:00,Will Dogecoin's Market Cap Soon Surpass Arista Networks'?,"Cryptocurrency's ascent following President Donald Trump's victory on election night has been truly remarkable. The price of Bitcoin, the world's largest cryptocurrency, has surged past $100,000 and many altcoins also skyrocketed.",https://www.msn.com/en-us/money/other/will-dogecoin-s-market-cap-soon-surpass-arista-networks/ar-AA1ygJN2,,MSN,DOGE
2025-02-02 15:51:00+00:00,"Shiba Inu's Shytoshi Steps Down, Dogecoin ETF Application And More: Top Crypto Updates This Week:","The week was a whirlwind of activity in the cryptocurrency world. From leadership changes to bold predictions, meme coins continued to make headlines. Here's a quick recap of the top stories that shaped the crypto landscape over the weekend.",https://www.benzinga.com/25/02/43423608/shiba-inus-shytoshi-steps-down-dogecoin-etf-application-and-more-top-crypto-updates-this-week,https://cdn.benzinga.com/files/images/story/2025/02/02/Bitcoin-Hits-Record-109-000-Ahead-Of-Tru.jpeg?width=1200&height=800&fit=crop,Benzinga.com,DOGE
2025-02-03 08:16:22+00:00,Ethereum leads crypto's $2.24B liquidation amid tariff wars,"Crypto markets saw $2.24 billion in liquidations after Trump's tariff announcement. ETH took the hardest hit, losing over $609.9 million.",https://www.msn.com/en-us/money/other/ethereum-leads-crypto-s-2-24b-liquidation-amid-tariff-wars/ar-AA1yjz9c,"https://images.cointelegraph.com/cdn-cgi/image/format=auto,onerror=redirect,quality=90,width=1200/https://s3.cointelegraph.com/uploads/2024-11/019359e5-0329-76e2-93cb-11b2b3912249",Cointelegraph.com on MSN.com,
2025-02-03 09:47:00+00:00,DDB Miner Shares Insights on How to Earn Profits with Cryptocurrency Cloud Mining,"Reuters, the news and media division of Thomson Reuters, is the world's largest multimedia news provider, reaching billions of people worldwide every day. Reuters provides business, financial, national and international news to professionals via desktop terminals, the world's media organizations, industry events and directly to consumers.",https://www.reuters.com/press-releases/ddb-mining-shares-insights-on-how-to-earn-profits-with-cryptocurrency-cloud-mining-2025-02-03/,,Reuters,
2025-02-03 10:30:00+00:00,"Better Cryptocurrency to Buy With $1,000 Right Now: Dogecoin vs. Shiba Inu",There are key differences between Dogecoin and Shiba Inu. Their links to Bitcoin and Ethereum have many implications. There are financial priorities that must be met before buying either coin.,https://www.fool.com/investing/2025/02/03/better-cryptocurrency-to-buy-with-1000-right-now-d/,,The Motley Fool,DOGE
2025-02-03 11:59:00+00:00,XRP as a potential US crypto reserve asset: Possibilities and challenges,"The most recent news about crypto industry at Cointelegraph. Latest news about bitcoin, ethereum, blockchain, mining, cryptocurrency prices and more",https://www.msn.com/en-us/money/markets/xrp-as-a-potential-us-crypto-reserve-asset-possibilities-and-challenges/ar-AA1yk2jG,,Cointelegraph.com on MSN.com,
2025-02-03 13:10:00+00:00,Will Dogecoin Remain King of Memes in 2025? Let's Dive into Chances of Success and Failure,"While Dogecoin (DOGE) still presents some opportunities, Panshibi has emerged as an inviting alternative, especially among Asian investors.",https://www.coinspeaker.com/will-dogecoin-remain-king-memes-2025-lets-dive-chances-success-failure/,,coinspeaker,DOGE
2025-02-03 15:00:00+00:00,Cryptocurrency tokenomics: How to profit on digital currency,"Tokenomics is a portmanteau of the words token and economics, and it's used to describe how a cryptocurrency is managed. Tokenomics includes all facets of the economic side of how a crypto coin is managed, rather than the technical or operational side of the equation.",https://www.aol.com/finance/cryptocurrency-tokenomics-profit-digital-currency-130000771.html,https://s.yimg.com/ny/api/res/1.2/AeDeQ8s220abuBztE8bE9g--/YXBwaWQ9aGlnaGxhbmRlcjt3PTEyMDA7aD02NzU-/https://media.zenfs.com/en/aol_bankrate_605/a8611652693eec33a48962697aeba6ca,AOL,
2025-02-03 15:29:00+00:00,"On Your Side: Better Business Bureau warns that AI, cryptocurrency bring new risks to romance scams","Looking for love? Better Business Bureau recommends looking out for romance scams when dating online, as AI tools and cryptocurrency lend new dimensions to old scams.",https://www.ky3.com/2025/02/03/your-side-better-business-bureau-warns-that-ai-cryptocurrency-bring-new-risks-romance-scams/,https://gray-ky3-prod.gtv-cdn.com/resizer/v2/NF5AXRG3L5AFZA7H3TMCLKJMXU.png?auth=7deeb734f0541d436dec34756573ebe7a9fcac191efe8f806b407f615b18c266&width=1200&height=600&smart=true,KY3,
