date,title,body,url,image,source,ticker
2025-01-15 06:56:00+00:00,AI Meets Blockchain - The Next Frontier Of Cryptocurrency,The cryptocurrency landscape is evolving far beyond digital money. While Bitcoin's surging value continues to capture headlines - partly due to optimism around Donald Trump's crypto-friendly ...,https://www.forbes.com/sites/bernardmarr/2025/01/15/ai-meets-blockchainthe-next-frontier-of-cryptocurrency/,,Forbes,
2025-01-15 09:04:00+00:00,Is cryptocurrency mining still profitable in 2025?,"It's the money, of course. Cryptocurrency mining is the process of validating transactions on a proof-of-work blockchain network, like Bitcoin or Ethereum Classic. Miners play a crucial role ...",https://cointelegraph.com/explained/is-cryptocurrency-mining-still-profitable,,CoinTelegraph,
2025-01-16 00:00:00+00:00,A First-Day Trump Order: A Federal Stockpile of Bitcoin?,"The cryptocurrency industry has pushed President-elect Donald J. Trump to establish one, creating real political momentum behind the plan. By David Yaffe-Bellany David Yaffe-Bellany covers the ...",https://www.nytimes.com/2025/01/16/technology/trump-bitcoin-stockpile.html,,The New York Times,
2025-01-16 20:57:00+00:00,Trump Plans to Designate Cryptocurrency as a National Priority,"President-elect Donald Trump is planning to release an executive order elevating crypto as a policy priority and giving industry insiders a voice within his administration, according to people familiar with the plans.",https://www.bloomberg.com/news/articles/2025-01-16/trump-plans-to-designate-cryptocurrency-as-a-national-priority,,Bloomberg L.P.,
2025-01-17 09:00:00+00:00,Can You Get Rich Using a Raspberry Pi to Mine Cryptocurrency?,"What about cryptocurrency? This is also made up by humans. You can ""mine"" crypto using a computer to do pointless, gnarly computations. These systems are usually set up so that it takes more ...",https://www.wired.com/story/can-you-get-rich-using-a-raspberry-pi-to-mine-crypto/,,Wired,
2025-01-17 20:58:00+00:00,What are the dozens of cryptocurrency ATMs around the Canberra region for and who is using them?,"The Canberra region has about 39 cryptocurrency ATMs, but for locals who haven't engaged with digital currency before their presence can be confusing. Cryptocurrencies, or cryptos, are digital ...",https://www.abc.net.au/news/2025-01-18/act-what-are-cryptocurrency-atms-for-and-who-is-using-them/104826982,,Australian Broadcasting Corporation,
2025-01-18 00:00:00+00:00,"Trump Begins Selling New Crypto Token, Raising Ethical Concerns","President-elect Donald J. Trump and his family on Friday started selling a cryptocurrency token featuring an image of Mr. Trump drawn from the July assassination attempt, a potentially lucrative ...",https://www.nytimes.com/2025/01/18/us/politics/trump-meme-coin-crypto.html,,The New York Times,
2025-01-18 15:35:00+00:00,"Trump's ""memecoin"" crypto venture gained billions in value overnight","Donald Trump is cashing in in his final hours before assuming the presidency. A cryptocurrency launched by the president-elect on Friday night, named $Trump in a ...",https://www.salon.com/2025/01/18/memecoin-crypto-venture-gained-billions-in-value-overnight/,,Salon,
2025-01-18 18:19:00+00:00,Trump mints $31 billion with new official $TRUMP crypto meme coin,"Just days before his second inauguration, President-elect Donald Trump issued a cryptocurrency meme coin memorializing his response to the July 2024 assassination ...",https://www.usatoday.com/story/money/2025/01/18/trump-meme-coin-price-crypto/77802704007/,,USA Today,
2025-01-19 00:00:00+00:00,Trump's Cryptocurrency Surges to Become One of the World's Most Valuable,By Eric Lipton and David Yaffe-Bellany Eric Lipton and David Yaffe-Bellany have been writing about the cryptocurrency industry for the last three years out of Washington and San Francisco.,https://www.nytimes.com/2025/01/19/us/politics/trump-cryptocurrency-surges.html,,The New York Times,
2025-01-19 00:00:00+00:00,"Trump promotes meme coin, raising ethics issues as value soars","Ahead of his inauguration, President-elect Donald Trump launched and promoted a new cryptocurrency venture, raising fresh ethical questions about his attempts to monetize the incoming ...",https://www.washingtonpost.com/politics/2025/01/19/trump-meme-coin-crypto/,,The Washington Post,
2025-01-19 15:59:00+00:00,How To Earn Passive Income With Cryptocurrency,Learn how to make your crypto work for you and earn passive income through various strategies in the digital asset space.,https://www.forbes.com/sites/digital-assets/article/how-to-earn-passive-income-cryptocurrency/,,Forbes,
2025-01-20 00:00:00+00:00,Melania Trump launches her own cryptocurrency,Incoming first lady Melania Trump has launched a cryptocurrency on the eve of her husband's inauguration as US president. The announcement comes after President-elect Donald Trump launched the ...,https://www.bbc.co.uk/news/articles/c98y47vrv2jo,,BBC,
2025-01-20 08:54:00+00:00,"Trump launches his own $TRUMP meme coin, price soars overnight","President-elect Donald Trump launched his own cryptocurrency on Friday, sparking a feverish buying that apparently sent its market capitalization soaring to several billion dollars, followed by an ...",https://www.cbsnews.com/news/trump-launches-own-meme-coin-cryptocurrency/,,CBS News,
2025-01-20 09:02:00+00:00,"Melania Trump's cryptocurrency valued at £1,400,000,000 within minutes of launching",Melania Trump becomes the latest to launch her own cryptocurrency ahead of Trump's inauguration Incoming first lady Melania Trump has launched her own cryptocurrency on the eve of her husband ...,https://metro.co.uk/2025/01/20/melania-trumps-cryptocurrency-valued-at-1400000000-within-minutes-of-launching-22393234/,,Metro,
2025-01-20 12:40:00+00:00,Melania Trump launches her own cryptocurrency ahead of Inauguration,Melania Trump launched a meme coin on the eve of her husband's inauguration — causing his own new cryptocurrency to briefly tank amid a buying frenzy. The incoming first lady dropped news of ...,https://nypost.com/2025/01/20/us-news/melania-trump-launches-cryptocurrency-ahead-of-inauguration/,,New York Post,
2025-01-20 17:38:00+00:00,Melania Trump coin: Melania and Donald both offer cryptocurrency meme coins,President Donald Trump's return to office could be inaugurating a new landscape in cryptocurrency. Just two days after launching the new $TRUMP cryptocurrency meme ...,https://www.palmbeachpost.com/story/news/trump/2025/01/20/trump-coin-melania-and-donald-both-offer-cryptocurrency-meme-coins/77836617007/,,Palm Beach Post,
2025-01-20 22:28:00+00:00,"Donald and Melania Trump debuted meme coins, $Trump and $Melania. Here's what to know.","President Trump, who has vowed to turn the U.S. into the cryptocurrency capital of the world, got a head start on those plans by debuting new his-and-her meme coins ...",https://www.cbsnews.com/news/donald-trump-melania-meme-coin-cryptocurrency-what-to-know/,,CBS News,
2025-01-21 16:49:00+00:00,What does the future of the cryptocurrency market look like under Trump 2.0? | The Excerpt,"On Sunday's episode of The Excerpt podcast: As Donald Trump prepares to take office on January 20th, the cryptocurrency world awaits with bated breath. Not only has the president-elect promised ...",https://www.usatoday.com/story/news/politics/2025/01/21/cryptocurrency-market-donald-trump-the-excerpt/77849487007/,,USA Today,
2025-01-22 20:51:00+00:00,Best Cryptocurrency Trading Courses for February 2025,"If you are seeking to find the best cryptocurrency courses, read and compare our carefully curated list of the best cryptocurrency trading courses available online.",https://www.investopedia.com/the-best-cryptocurrency-trading-courses-8778166,https://www.investopedia.com/thmb/4aZsLkl8MXcHmp32-a0xjP4-CPs=/1500x0/filters:no_upscale():max_bytes(150000):strip_icc()/BestCryptocurrencyTradingCoursesforJanuary2025-30bf223b48eb4896bbdbd9e803c70da5.jpg,Investopedia,
2025-01-24 20:36:00+00:00,5 Must-Know Tips Before Buying Your First Cryptocurrency,"Cryptocurrency has revolutionized the financial landscape, offering unprecedented opportunities for investment and financial freedom. However, for beginners, diving into the crypto world can be daunting.",https://www.msn.com/en-us/money/personalfinance/5-must-know-tips-before-buying-your-first-cryptocurrency/ar-AA1xOLSy,,MSN,
2025-01-24 22:48:00+00:00,Hampton police use new tools to investigate cryptocurrency scams,"Officials in Hampton say residents of the town were scammed out of $1 million last year, mostly involving cryptocurrency, and police are now working to get that money back.",https://www.msn.com/en-us/crime/general/hampton-police-use-new-tools-to-investigate-cryptocurrency-scams/ar-AA1xOFAa,,WMUR Manchester on MSN.com,
2025-01-27 00:38:12+00:00,Why the Official Trump Cryptocurrency Is Plummeting This Week,"The Official Trump cryptocurrency has seen a big pullback over the last week of trading. The token was launched late on Jan. 17 and rocketed higher in its first day on the market, but it's subsequently seen a significant valuation decline.",https://www.msn.com/en-us/money/companies/why-the-official-trump-cryptocurrency-is-plummeting-this-week/ar-AA1xUaHW,,The Motley Fool on MSN.com,
2025-01-28 15:22:08+00:00,"Cryptocurrency scams cost Texans the most in 2024, BBB says","According to BBB's data, in just two years, scam reports have doubled and losses increased by more than 430%. Cryptocurrency/investment scams were the costliest. ""$3.1 million out the door in 2024 from Texas residents due to an investment involving digital Bitcoin, digital currencies, cryptocurrencies,"" said Meza.",https://www.msn.com/en-us/money/economy/cryptocurrency-scams-cost-texans-the-most-in-2024-bbb-says/ar-AA1y0E4H,https://www.kxan.com/wp-content/uploads/sites/40/2025/01/GettyImages-1334805030.jpg?w=1280,KXAN Austin on MSN.com,
2025-01-28 16:11:00+00:00,What is a crypto task force? What to know about Trump's new cryptocurrency executive order,Trump's plans to create a more crypto-friendly government. He introduced a new task force. Here's what it could mean for crypto.,https://www.usatoday.com/story/money/2025/01/28/crypto-task-force-trump-executive-order/77993052007/,"https://www.usatoday.com/gcdn/authoring/authoring-images/2025/01/23/USAT/77910100007-20250121-t-083346-z-969206937-rc-2-ziba-2-jcb-2-rtrmadp-3-usatrumpcrypto.JPG?crop=4607,2593,x0,y239&width=3200&height=1802&format=pjpg&auto=webp",USA Today,
2025-01-28 17:32:00+00:00,SeaDream becomes first cruise line to accept cryptocurrency payments for all voyages,"Passengers can now book sailings to destinations such as the Caribbean and Mediterranean using bitcoin, ethereum and more than 200 other cryptocurrencies",https://www.aol.com/seadream-becomes-first-cruise-line-153310015.html,https://media.zenfs.com/en/aol_the_independent_us_877/cf15fdeeea54a1e79a1c284d0201db23,AOL,
2025-01-29 14:00:00+00:00,Crypto mobile wallets hit 36M record high amid growing retail adoption,"Mobile cryptocurrency wallets reached a new all-time high of over 36 million in the fourth quarter of 2024, according to Coinbase's quarterly crypto market report, published on Jan. 29. ""Mobile wallets can play a critical role in turning passive crypto owners into active crypto users,"" wrote Daren Matsuoka, data scientist at a16z Crypto.",https://cointelegraph.com/news/crypto-mobile-wallets-36-m-record-high-retail-adoption,"https://images.cointelegraph.com/cdn-cgi/image/format=auto,onerror=redirect,quality=90,width=1200/https://s3.cointelegraph.com/uploads/2025-01/0194b18b-00dc-7b29-a287-cfd061f76435",CoinTelegraph,
2025-01-29 21:05:04+00:00,Avoiding the next collapse: Study unveils the factors behind cryptocurrency exchange failures,"Imagine logging into your cryptocurrency exchange platform one morning only to find the website down, your funds gone, and no one to answer your questions. This nightmare has been a harsh reality for thousands of traders,",https://www.msn.com/en-us/money/other/avoiding-the-next-collapse-study-unveils-the-factors-behind-cryptocurrency-exchange-failures/ar-AA1y5454,https://img-s-msn-com.akamaized.net/tenant/amp/entityid/AA1y521c.img?w=1280&h=646&m=4&q=84,Phys.org on MSN.com,
2025-01-30 06:19:00+00:00,UFC's Instagram account hacked: Promotion confirms cryptocurrency post as fraudulent,"Wednesday evening, the Las Vegas-based MMA promotion's Instagram account displayed a bizzare cryptocurrency post, suggesting the UFC was launching a new coin. A promotion official quickly confirmed to MMA Junkie that the post is not legitimate and the account has been hacked.",https://mmajunkie.usatoday.com/2025/01/ufc-instagram-account-hacked-cryptocurrency-scam-post,https://mmajunkie.usatoday.com/wp-content/uploads/sites/91/2023/07/UFC-octagon-cage-fence-background.png?w=1024&h=576&crop=1,MMA Junkie,
2025-01-30 10:15:00+00:00,Nuclear power in North Tonawanda? Cryptocurrency operation shows interest,"Digihost, a cryptocurrency mining operation, said it may want to use small nuclear reactors to power its facility located off Erie Avenue in North Tonawanda.",https://buffalonews.com/news/local/digihost-cryptomining-north-tonawanda-fortistar-nuclear-power/article_5428cec0-de60-11ef-842e-6bb01d985fd6.html,"https://bloximages.chicago2.vip.townnews.com/buffalonews.com/content/tncms/assets/v3/editorial/5/42/5428cec0-de60-11ef-842e-6bb01d985fd6/679aa9f906052.preview.jpg?crop=1920,1008,0,35&resize=1200,630&order=crop,resize",Buffalo News,
2025-01-30 15:37:00+00:00,Gatbit: Leading Cryptocurrency Exchange for Successful Trading in 2025,"In the world of cryptocurrencies, where competition grows stronger every day, Gatbit.com has long established itself a",https://www.msn.com/en-us/news/other/gatbit-leading-cryptocurrency-exchange-for-successful-trading-in-2025/ar-AA1y7XsA,https://img-s-msn-com.akamaized.net/tenant/amp/entityid/AA1y89H8.img?w=1600&h=992&m=4&q=100,MSN,
2025-01-30 21:15:00+00:00,Solana stablecoin supply up 73% since TRUMP launch: CCData,Solana's stablecoin supply has jumped by more than 73% since the Jan. 18 TRUMP token launch drew thousands of new users onto the network.,https://www.msn.com/en-us/money/markets/solana-stablecoin-supply-up-73-since-trump-launch-ccdata/ar-AA1y8Yio,"https://images.cointelegraph.com/cdn-cgi/image/format=auto,onerror=redirect,quality=90,width=1200/https://s3.cointelegraph.com/uploads/2025-01/0194b8cd-216c-7e0f-b350-b6860c6a85a1",Cointelegraph.com on MSN.com,SOL
2025-01-31 00:00:00+00:00,"Manchester court sentences 7 for kidnapping, $124K crypto extortion","Seven UK gang members who kidnapped, tortured and extorted a cryptocurrency investor have been convicted and sentenced to prison terms. The victim was repeatedly targeted, assaulted and forced to ...",https://cointelegraph.com/news/gang-members-sentenced-kidnapping-cryptocurrency-investor,,CoinTelegraph,
2025-01-31 10:06:00+00:00,"Better Cryptocurrency to Buy With $1,000 Right Now: Solana vs. Shiba Inu","When comparing the outcome of investing in the primary token of a major blockchain like Solana (SOL -2.55%) or investing in a silly meme coin like Shiba Inu (SHIB -0.27%), the res",https://www.msn.com/en-us/money/markets/better-cryptocurrency-to-buy-with-1000-right-now-solana-vs-shiba-inu/ar-AA1yaChW,,The Motley Fool on MSN.com,
2025-01-31 15:31:42+00:00,Gulbit: Leading Cryptocurrency Exchange for Successful Trading in 2025,"In the world of cryptocurrencies, where competition grows stronger every day, Gulbit.com has long established itself a",https://www.msn.com/en-us/money/markets/gulbit-leading-cryptocurrency-exchange-for-successful-trading-in-2025/ar-AA1ybHMI,https://img-s-msn-com.akamaized.net/tenant/amp/entityid/AA1ybTeS.img?w=1280&h=1011&m=4&q=83,American Woman on MSN.com,
2025-01-31 19:22:00+00:00,Gang who kidnapped man for cryptocurrency jailed,Gang members who kidnapped a man and forced him to handover hundreds of thousands of pounds worth of cryptocurrency have been jailed - after they were tracked down from DNA left on cigarette butts.,https://www.msn.com/en-us/news/crime/gang-who-kidnapped-man-for-cryptocurrency-jailed/ar-AA1ycgWR,https://media.zenfs.com/en/aol_bbc_articles_618/ed0ef6cc904e9b8092f15a4451f3d863,BBC on MSN.com,
2025-01-31 20:18:00+00:00,Betting on Bitcoin? Here's what you need to know before you invest,"NYU finance professor David Yermack weighs in on the potential risks and benefits of investing in crypto and more specifically, Bitcoin.",https://www.msn.com/en-us/money/other/thinking-of-investing-in-crypto-expert-weighs-in-on-potential-benefits-risks/ar-AA1ybPfy,"https://kubrick.htvapps.com/vidthumb/images/bitcoin-thumbnail-v1-679bf922a5734.png?crop=1xw:1xh;center,top&resize=1200:*",WPTZ Plattsburgh-Burlington on MSN.com,
2025-02-01 10:18:48+00:00,"Ethereum needs more blockchain activity, adoption, to recapture $4K","Ethereum needs more fundamental blockchain activity to recapture the $4,000 mark, but $3,400 remains a significant resistance.",https://www.msn.com/en-us/money/economy/ethereum-needs-more-blockchain-activity-adoption-to-recapture-4k/ar-AA1ydYeU,"https://images.cointelegraph.com/cdn-cgi/image/format=auto,onerror=redirect,quality=90,width=1200/https://s3.cointelegraph.com/uploads/2024-11/0193538d-1a99-739a-8605-6d8e627eab6a",Cointelegraph.com on MSN.com,
2025-02-01 13:06:00+00:00,Is Solana a Once-in-a-Decade Buying Opportunity Below $250?,"The network is seeing more usage. Total value locked (TVL), a measure of the amount of money that's locked into a particular blockchain, is $11.1 billion on Solana. That figure still pales in comparison to Ethereum's $63.2 billion, but Solana's growth since the start of 2024 has been astronomically higher.",https://www.msn.com/en-us/money/topstocks/is-solana-a-once-in-a-decade-buying-opportunity-below-250/ar-AA1yenQb,https://g.foolcdn.com/editorial/images/805429/trader-pondering-at-screens.jpg,The Motley Fool on MSN.com,SOL
2025-02-02 23:33:00+00:00,"1 Top Cryptocurrency to Buy Before It Soars 600%, According to Billionaire Larry Fink of BlackRock","The good news is that Bitcoin is likely nowhere close to hitting its true ceiling. According to Larry Fink, CEO of asset management giant BlackRock, Bitcoin could eventually soar as high as $700,000. Based on today's prices, that would represent a nearly 600% return on investment.",https://www.msn.com/en-us/money/mutualfunds/1-top-cryptocurrency-to-buy-before-it-soars-600-according-to-billionaire-larry-fink-of-blackrock/ar-AA1yia6X,https://g.foolcdn.com/editorial/images/805690/gold-coin-with-bitcoin-symbol-on-it-cryptocurrency-btc.jpg,The Motley Fool on MSN.com,
2025-02-03 08:16:22+00:00,Ethereum leads crypto's $2.24B liquidation amid tariff wars,"Crypto markets saw $2.24 billion in liquidations after Trump's tariff announcement. ETH took the hardest hit, losing over $609.9 million.",https://www.msn.com/en-us/money/other/ethereum-leads-crypto-s-2-24b-liquidation-amid-tariff-wars/ar-AA1yjz9c,"https://images.cointelegraph.com/cdn-cgi/image/format=auto,onerror=redirect,quality=90,width=1200/https://s3.cointelegraph.com/uploads/2024-11/019359e5-0329-76e2-93cb-11b2b3912249",Cointelegraph.com on MSN.com,
2025-02-03 09:47:00+00:00,DDB Miner Shares Insights on How to Earn Profits with Cryptocurrency Cloud Mining,"Reuters, the news and media division of Thomson Reuters, is the world's largest multimedia news provider, reaching billions of people worldwide every day. Reuters provides business, financial, national and international news to professionals via desktop terminals, the world's media organizations, industry events and directly to consumers.",https://www.reuters.com/press-releases/ddb-mining-shares-insights-on-how-to-earn-profits-with-cryptocurrency-cloud-mining-2025-02-03/,https://www.reuters.com/resizer/v2/https://app.eznewswire.com/rails/active_storage/blobs/redirect/eyJfcmFpbHMiOnsibWVzc2FnZSI6IkJBaHBBcEI4IiwiZXhwIjpudWxsLCJwdXIiOiJibG9iX2lkIn19--ac3a3b662b4bc70b6817e33a5762ba99c71ed571/DDB%E8%83%8C%E6%99%AF-(1).jpg?auth=10c066f8b31b7ca017d1e48f1655dc3d2c15af97979b93c1013198f957e2874f&height=1005&width=1920&quality=80&smart=true,Reuters,
2025-02-03 11:59:00+00:00,XRP as a potential US crypto reserve asset: Possibilities and challenges,"The most recent news about crypto industry at Cointelegraph. Latest news about bitcoin, ethereum, blockchain, mining, cryptocurrency prices and more",https://www.msn.com/en-us/money/markets/xrp-as-a-potential-us-crypto-reserve-asset-possibilities-and-challenges/ar-AA1yk2jG,,Cointelegraph.com on MSN.com,
2025-02-03 12:16:41+00:00,Solana stablecoins attain 2x market cap in January,USDC dominates Solana's stablecoin market which grew by more than double its value throughout January thanks to memecoin speculators.,https://www.msn.com/en-us/money/economy/solana-stablecoins-attain-2x-market-cap-in-january/ar-AA1yk8Pg,"https://images.cointelegraph.com/cdn-cgi/image/format=auto,onerror=redirect,quality=90,width=1200/https://s3.cointelegraph.com/uploads/2025-02/0194cb6d-c0cc-74d0-8f00-ef5759cf6648",Cointelegraph.com on MSN.com,SOL
2025-02-03 14:39:00+00:00,New Solana layer-2 project Solaxy raises $17m ahead of launch,"Solaxy's presale has attracted early attention from investors. The presale has now raised $17.5 million as interest in the project's layer-2 solution grows. SOLX, Solaxy's native token, is currently priced at $0.001624 during the presale - with its next scheduled price increase within 48 hours.",https://cointelegraph.com/market-releases/new-solana-layer-2-project-solaxy-raises-17m-ahead-of-launch,"https://images.cointelegraph.com/cdn-cgi/image/format=auto,onerror=redirect,quality=90,width=1200/https://s3.cointelegraph.com/storage/uploads/view/404937415cef5f30b08f258b3f992808.jpg",Cointelegraph,SOL
2025-02-03 15:00:00+00:00,Cryptocurrency tokenomics: How to profit on digital currency,"Tokenomics is a portmanteau of the words token and economics, and it's used to describe how a cryptocurrency is managed. Tokenomics includes all facets of the economic side of how a crypto coin is managed, rather than the technical or operational side of the equation.",https://www.aol.com/finance/cryptocurrency-tokenomics-profit-digital-currency-130000771.html,https://s.yimg.com/ny/api/res/1.2/AeDeQ8s220abuBztE8bE9g--/YXBwaWQ9aGlnaGxhbmRlcjt3PTEyMDA7aD02NzU-/https://media.zenfs.com/en/aol_bankrate_605/a8611652693eec33a48962697aeba6ca,AOL,
2025-02-03 15:29:00+00:00,"On Your Side: Better Business Bureau warns that AI, cryptocurrency bring new risks to romance scams","Looking for love? Better Business Bureau recommends looking out for romance scams when dating online, as AI tools and cryptocurrency lend new dimensions to old scams.",https://www.ky3.com/2025/02/03/your-side-better-business-bureau-warns-that-ai-cryptocurrency-bring-new-risks-romance-scams/,https://gray-ky3-prod.gtv-cdn.com/resizer/v2/NF5AXRG3L5AFZA7H3TMCLKJMXU.png?auth=7deeb734f0541d436dec34756573ebe7a9fcac191efe8f806b407f615b18c266&width=1200&height=600&smart=true,KY3,
2025-02-03 18:45:00+00:00,"Solana's stablecoin market cap surges 116% in 30 days, hitting $11.7B","According to DefiLlama, Solana's stablecoin market cap has grown by almost 6% in the last week, passing the $11 billion threshold. In January alone, the network saw about $1.6 trillion in stablecoin transfers, beating Ethereum's $607 billion and Base's $664 billion.",https://www.msn.com/en-us/money/markets/solana-s-stablecoin-market-cap-surges-116-in-30-days-hitting-117b/ar-AA1ylEWG,https://www.cryptopolitan.com/wp-content/uploads/2025/02/Solanas-stablecoin-market-cap-surges-116-in-30-days-hitting-11.6B.webp,Cryptopolitan on MSN.com,SOL
2025-02-04 00:00:00+00:00,US Congress to form cryptocurrency working group,U.S. President Donald Trump in January ordered formation of a cryptocurrency working group comprised of agency heads tasked with proposing new digital asset regulations and exploring creation of a ...,https://www.reuters.com/world/us/us-congress-form-cryptocurrency-working-group-2025-02-04/,,Reuters,
2025-02-04 03:25:00+00:00,Solana Price Prediction: SOL Surges 15% As This Layer-2 Crypto Presale Hurtles Towards $18 Million,The Solana price soared over 15% in the last 24 hours as this layer-2 crypto presale storms towards $18 million.,https://insidebitcoins.com/news/solana-price-prediction-sol-surges-15-as-this-layer-2-crypto-presale-hurtles-towards-18-million,https://insidebitcoins.com/wp-content/uploads/2025/02/Solana-price_optimized-4.jpg,InsideBitcoins,SOL
2025-02-04 10:30:00+00:00,"Billionaires Are Selling Nvidia and Buying a Cryptocurrency ETF That Some Wall Street Experts Think May Soar Up to 3,500%","Two billionaire hedge fund managers who have embraced Bitcoin are Israel Englander, head of Millennium Management, and Yan Huo, head of Capula Management. Collectively, they manage more than $120 billion in assets, so any moves they take may be emulated by other investors.",https://www.msn.com/en-us/technology/tech-companies/billionaires-are-selling-nvidia-and-buying-a-cryptocurrency-etf-that-some-wall-street-experts-think-may-soar-up-to-3-500/ar-AA1ynxx8,https://g.foolcdn.com/editorial/images/806020/golden-bitcoin-coin-representing-the-electronic-currency.jpg,The Motley Fool on MSN.com,
2025-02-04 10:35:00+00:00,1 Top Cryptocurrency Stock to Buy in 2025,"It could mean fewer legal challenges to deal with, and if cryptocurrency isn't such a hot-button issue, that could also help attract more institutional investors. Equally as important is that ...",https://www.fool.com/investing/2025/02/04/1-top-cryptocurrency-stock-to-buy-in-2025/,,The Motley Fool,
2025-02-04 12:36:00+00:00,Solana Flips $200: Will Recovery Rally Push SOL Price to $236?,"Rising against the crypto crash, Solana aims for a quick turnaround from the $200 psychological mark to reach $250.",https://www.coinspeaker.com/solana-flips-200-will-recovery-rally-push-sol-236/,,Coinspeaker,SOL
