date,title,body,url,image,source,ticker
2025-02-04 13:17:12+00:00,Coinbase urges US regulators to remove crypto banking barriers,Coinbase crypto exchange is standing up to US banking regulators to ensure that US banks are free to provide their services to crypto businesses.,https://www.msn.com/en-us/money/financial-regulation/coinbase-urges-us-regulators-to-remove-crypto-banking-barriers/ar-AA1yoktG,"https://images.cointelegraph.com/cdn-cgi/image/format=auto,onerror=redirect,quality=90,width=1200/https://s3.cointelegraph.com/uploads/2025-02/0194d0da-902a-7fa3-b29b-3c83ae964870",Cointelegraph.com on MSN.com,
2025-02-04 18:10:00+00:00,"Sol Strategies Bolsters Solana Holdings to Near 190,000 SOL Worth More Than $40M","The company, led by former Valkyrie Investments co-founder Leah Wald, has acquired validators on other blockchains and holds some BTC along with SOL.",https://www.coindesk.com/business/2025/02/04/sol-strategies-bolsters-solana-holdings-to-near-190-000-sol-worth-more-than-usd40m,https://www.coindesk.com/_next/image?url=https://cdn.sanity.io/images/s3y3vcno/production/437b95c30472963ec00dc8cd19d9fa0c00c39f50-1024x683.jpg?auto=format&w=2048&q=75,CoinDesk,SOL
2025-02-04 18:56:00+00:00,US Congress to form cryptocurrency working group,"U.S. Representative French Hill, a Republican who chairs the House Financial Services Committee, said on Tuesday lawmakers from both chambers of congress would form a working group to develop policy favoring development of digital assets.",https://www.aol.com/news/us-congress-form-cryptocurrency-working-195659459.html,https://media.zenfs.com/en/aol_reuters_29/f84160422faef086d93b105826afcefd,AOL,
2025-02-05 05:00:00+00:00,"Better Cryptocurrency to Buy With $5,000 in 2025: Solana vs. Bitcoin","Whereas Bitcoin's strength is that its protocol is largely unchanging, making it a bulwark of stability in the highly fluid cryptocurrency sector, Solana is still being actively developed by its ...",https://www.fool.com/investing/2025/02/05/better-cryptocurrency-to-buy-with-5000-in-2025-sol/,,The Motley Fool,
2025-02-05 05:27:00+00:00,Local 18-year-old helps develop Cryptocurrency website to teach beginners how to safely navigate it.,"As Cryptocurrencies, such as Bitcoin or Litecoin, become more popular in this digital age, one local home-school student is helping other students and new users learn the basics of Cryptocurrency trading.",https://www.msn.com/en-us/news/technology/local-18-year-old-helps-develop-cryptocurrency-website-to-teach-beginners-how-to-safely-navigate-it/ar-AA1yqmmW,,Waco-Temple-Bryan KWTX-TV on MSN.com,
2025-02-05 10:30:00+00:00,Crypto Industry Looks to New SEC Task Force for Quick Action in Its Favor,Industry groups have a wish list they say could bring more regulatory clarity around cryptocurrencies and allow for growth.,https://www.msn.com/en-us/money/financial-regulation/crypto-industry-looks-to-new-sec-task-force-for-quick-action-in-its-favor/ar-AA1yrMvx,,The Wall Street Journal on MSN.com,
2025-02-05 11:30:56+00:00,Trump spooks Bitcoin: Why cryptocurrency prices falling and what's next,"The cryptocurrency market has collapsed again under the influence of political decisions, including the price of Bitcoin. Total losses of investors are estimated at tens of billions of dollars. Read about why the cryptocurrency market collapsed,",https://www.msn.com/en-ca/money/other/trump-spooks-bitcoin-why-cryptocurrency-prices-falling-and-what-s-next/ar-AA1ys6Bq,https://img-s-msn-com.akamaized.net/tenant/amp/entityid/AA1ysbv7.img?w=1300&h=820&m=4&q=79,RBC Ukraine on MSN.com,
2025-02-05 16:34:53+00:00,"2 things could drive bitcoin to $500,000 during Trump's term, a top crypto analyst says","""Although the near-term remains choppy for Bitcoin, the long-term is becoming clearer by the day,"" Standard Chartered said.",https://www.msn.com/en-us/money/markets/2-things-could-drive-bitcoin-to-500000-during-trumps-term-a-top-crypto-analyst-says/ar-AA1ytqcM,,Markets Insider on MSN.com,
2025-02-05 21:49:00+00:00,Solana app revenues up 213% in Q4: Messari,"Solana app revenues increased by 213% in Q4 2024, largely due to memecoin speculation, according to a report by Messari.",https://www.msn.com/en-us/money/technology/solana-app-revenues-up-213-in-q4-messari/ar-AA1yu7jC,"https://images.cointelegraph.com/cdn-cgi/image/format=auto,onerror=redirect,quality=90,width=1200/https://s3.cointelegraph.com/uploads/2024-11/019347bb-2d57-7a07-94e9-4531a66feb9d",Cointelegraph.com on MSN.com,SOL
2025-02-06 00:24:00+00:00,"Bitcoin approaches $100,000 as Trump's pro-crypto policies take shape","Despite Bitcoin topping $100,000 this week, the world's largest cryptocurrency has slipped below that critical threshold again, and is currently trading at a price near $97,200.",https://www.thestreet.com/crypto/markets/bitcoin-approaches-100000-as-trumps-pro-crypto-policies-take-shape,,TheStreet.com,
2025-02-06 09:45:00+00:00,Solana (SOL) Price: Sees 213% Growth as Network Activity Soars,"Solana's network achieved record-breaking performance in Q4 2024 with $840 million in application revenue, marking a 213% quarterly increase and establishing itself as the second-largest DeFi network.",https://blockonomi.com/solana-sol-price-sees-213-growth-as-network-activity-soars/,https://blockonomi.com/wp-content/uploads/2024/08/solana.jpg,blockonomi,SOL
2025-02-06 10:31:56+00:00,"Solana's on-chain GDP grew by over 300% in Q4, led by memes and bot activity","Solana completed its most successful quarter at the end of 2024, driven by app revenues that surpassed the performance of Ethereum (ETH).",https://www.msn.com/en-us/money/markets/solana-s-on-chain-gdp-grew-by-over-300-in-q4-led-by-memes-and-bot-activity/ar-AA1ywmf5,https://www.cryptopolitan.com/wp-content/uploads/2025/02/SolProtocolsfeb62025.png,Cryptopolitan on MSN.com,SOL
2025-02-06 12:59:52+00:00,Solana survived its record year with no network downtime,"Solana (SOL) has not suffered a consensus failure since February 2024, though the network has encountered other sources of transaction delays.",https://www.msn.com/en-us/money/other/solana-survived-its-record-year-with-no-network-downtime/ar-AA1ywSlY,https://www.cryptopolitan.com/wp-content/uploads/2025/02/SolSuccessFeb62025.png,cryptopolitan on MSN.com,SOL
2025-02-06 16:00:33+00:00,"Solana Celebrates 1-Year No Downtime, Becomes Second-Largest DeFi Network","Solana commands $9.34 billion in TVL, Ethereum TVL stands at $57.92 billion. Over 30% of Solana transactions fail on average. Pump.fun Solana DEX transactions accounted",https://www.msn.com/en-us/money/companies/solana-celebrates-1-year-no-downtime-becomes-second-largest-defi-network/ar-AA1yxh9J,https://img-s-msn-com.akamaized.net/tenant/amp/entityid/AA1yxuQd.img?w=1920&h=1080&m=4&q=100,CCN on MSN.com,SOL
2025-02-06 18:17:00+00:00,Is Cryptocurrency the Future of Tourism in the Finger Lakes?,"Where tourism is concerned, it's important for payment methods to be easy to access, safe, and offer global transactions - all of which can be found with crypto. More tourist hotspots are now accepting a variety of payment methods including cryptocurrencies,",https://www.fingerlakes1.com/2025/02/06/is-cryptocurrency-the-future-of-tourism-in-the-finger-lakes/,,fingerlakes1,
2025-02-06 19:44:00+00:00,SEC Officials Instructed to Shrink Cryptocurrency Enforcement Team: Report,The U.S. Securities and Exchange Commission (SEC) is reportedly downsizing a special unit of more than 50 lawyers and staff members tasked to bring crypto enforcement actions.,https://dailyhodl.com/2025/02/06/sec-officials-instructed-to-halt-cryptocurrency-enforcement-actions-report/,https://dailyhodl.com/wp-content/uploads/2025/02/to-halt-actions.jpg?w=750&h=375&crop=1,The Daily Hodl,
2025-02-06 19:44:00+00:00,VanEck predicts Solana will reach $520 by the end of the year,"Asset manager VanEck says Solana could surge to $520 per token by the end of 2025, according to their latest market report released today.",https://www.msn.com/en-us/money/other/vaneck-predicts-solana-will-reach-520-by-the-end-of-the-year/ar-AA1yy6Cu,,Cryptopolitan on MSN.com,SOL
2025-02-07 00:00:00+00:00,XRP and Solana race toward the next crypto ETF approval,"XRP and Solana are both making strides toward securing approval for their own spot exchange-traded funds (ETFs), each with a compelling case to be the first to cross the regulatory finish line.",https://cointelegraph.com/news/xrp-solana-race-crypto-etf-approval,,CoinTelegraph,SOL
2025-02-07 01:34:58+00:00,SEC acknowledges Grayscale Solana ETF filing in 'notable' step,The SEC has acknowledged Grayscale's spot Solana ETF — advancing the review process after former chair Gary Gensler's SEC reportedly refused to acknowledge recent Solana ETF filings.,https://www.msn.com/en-us/money/markets/sec-acknowledges-grayscale-solana-etf-filing-in-notable-step/ar-AA1yyT4W,"https://images.cointelegraph.com/cdn-cgi/image/format=auto,onerror=redirect,quality=90,width=1200/https://s3.cointelegraph.com/uploads/2025-02/0194dd6b-cce6-715c-8481-38d963689bcc",Cointelegraph.com on MSN.com,SOL
2025-02-07 03:30:00+00:00,Solana Price Prediction: SOL Plunges 18% In A Week As Investors Pivot To This $18 Million Layer-2 Meme Coin For Its 220% APY,The Solana price plunged over 18% in the last week as investors pivot to this layer-2 meme coin offering a 220% APY.,https://insidebitcoins.com/news/solana-price-prediction-sol-plunges-18-in-a-week-as-investors-pivot-to-this-18-million-layer-2-meme-coin-for-its-220-apy,,InsideBitcoins,SOL
2025-02-07 06:44:00+00:00,"Solana's SOL Could Hit $520 by 2025-End, VanEck Says","VanEck predicts M2 money supply will grow to $22.3 trillion by 2025 from the current $21.5 trillion, boosting crypto markets and top tokens such as SOL.",https://www.coindesk.com/markets/2025/02/07/vaneck-sees-solana-s-sol-touching-usd520-in-2025,https://cdn.sanity.io/images/s3y3vcno/production/986e63e35ef2b083a791229fdee4da648e75fe85-1500x1000.jpg?auto=format,CoinDesk,SOL
2025-02-07 07:23:00+00:00,"Solana's DeFi, NFTs, and Institutional Adoption Drove 213% Revenue Growth in Q4 2024 - Messari","Solana's Q4 2024 saw a 213% revenue surge, driven by DeFi growth, meme coin trading, and rising institutional adoption.",https://cryptonews.com/news/solana-defi-nft-institutional-adoption-drove-213-revenue-growth-in-q4-2024-messari/,https://cimg.co/wp-content/uploads/2025/02/07071727/1738912647-untitled_optimized.jpeg,cryptonews,SOL
2025-02-07 07:50:00+00:00,Can Solana Ever Reach Ethereum's Marketcap? Remittix Blasts Into Crypto Limelight As It Sells 450 Million Tokens!,When it comes to discussing the competition between Solana and Ethereum within the cryptocurrency market the discussions remain speculative and contentious. Investors currently show strong interest in Solana because of its rapid transaction capabilities which will potentially confront Ethereum in the market leadership.,https://techbullion.com/can-solana-ever-reach-ethereums-marketcap-remittix-blasts-into-crypto-limelight-as-it-sells-450-million-tokens/,https://techbullion.com/wp-content/uploads/2025/02/Screenshot-2025-02-07-114940.jpg,TechBullion,SOL
2025-02-07 07:52:00+00:00,VanEck Predicts Solana Will Skyrocket to $520 by 2025,"VanEck has painted a bold picture for Solana's future, predicting that the smart contract platform's token, SOL (SOL-USD), could surge to $520",https://markets.businessinsider.com/news/stocks/vaneck-predicts-solana-will-skyrocket-to-520-by-2025-1034325900,,Markets Insider,SOL
2025-02-07 09:22:00+00:00,Solana (SOL) Price: Target of $520 Set by VanEck as Smart Contract Platforms Surge,"VanEck forecasts SOL to reach $520 by end of 2025, driven by projected M2 money supply growth to $22.3T and Solana's expected market share increase to 22% of the smart contract platform market.",https://blockonomi.com/solana-sol-price-target-of-520-set-by-vaneck-as-smart-contract-platforms-surge/,https://blockonomi.com/wp-content/uploads/2018/08/vaneck-letter.jpg,blockonomi,SOL
2025-02-07 10:15:02+00:00,Emerging cryptocurrency stuns market with game-changing acquisition: 'Represents a significant milestone',"""This transaction proves the quality and stability of Letscoin."" Emerging cryptocurrency stuns market with game-changing acquisition: 'Represents a significant milestone' first appeared on The Cool Down.",https://www.msn.com/en-us/lifestyle/lifestyle-buzz/emerging-cryptocurrency-stuns-market-with-game-changing-acquisition-represents-a-significant-milestone/ar-AA1yfZP3,https://img-s-msn-com.akamaized.net/tenant/amp/entityid/AA1yfLps.img?w=640&h=360&m=4&q=88,The Cool Down on MSN.com,
2025-02-07 11:00:00+00:00,"Want to Make $10,000 With XRP or Solana? Do These 3 Things","XRP (XRP -2.89%) and Solana (SOL -2.26%) are two major cryptocurrencies that have been generating a lot of wealth for their investors during the past few years, including those wh",https://www.msn.com/en-us/money/personalfinance/want-to-make-10000-with-xrp-or-solana-do-these-3-things/ar-AA1yAl0q,,The Motley Fool on MSN.com,SOL
2025-02-07 11:20:00+00:00,Solana (SOL) Price Update: Recent Movements and Growth Projections,Investment firm VanEck is fairly optimistic that Solana (SOL) will hit $520 before the end of the year running.,https://www.coinspeaker.com/vaneck-predicts-solana-sol-could-soar-520-2025-heres-how/,,Coinspeaker,SOL
2025-02-07 12:26:51+00:00,"Solana To $520 By End Of 2025, VanEck Predicts","Asset manager VanEck has projected a price target of $520 for Solana (CRYPTO: SOL) by the end of 2025, citing its rising market share within the smart contract platform sector.",https://www.msn.com/en-us/money/other/solana-to-520-by-end-of-2025-vaneck-predicts/ar-AA1yAXit,https://cdn.benzinga.com/files/images/story/2025/02/07/Solana-Sol-Cryptocurrency-Physical-Coin-.jpeg?width=1200&height=800&fit=crop,Benzinga.com on MSN.com,SOL
2025-02-07 13:20:00+00:00,What's next for Tampa's hurricane-battered Beer Can Island? Cryptocurrency.,"When Pine Key reopens, owners plan to accept payment for drinks, concert tickets and more using a new meme coin.",https://www.msn.com/en-us/news/us/what-s-next-for-tampa-s-hurricane-battered-beer-can-island-cryptocurrency/ar-AA1yAQhP,https://www.tampabay.com/resizer/v2/4SIPF3TFHBB25PDZQHYQ64OA2U.jpg?auth=d6bca256bf12e78b7a971a5fcb721b182d3fcbd26058d9b44f619268518e862e&height=675&width=1200&smart=true,Tampa Bay Times on MSN.com,
2025-02-07 13:28:00+00:00,Solana ETFs Edge Closer To Approval As SEC Acknowledges Grayscale Filing - Is This Layer 2 SOL Project Set To Soar?,The SEC moved closer to approving Solana ETFs by acknowledging a filing by Grayscale. Will Solana projects like this layer 2 soar?,https://insidebitcoins.com/news/solana-etfs-edge-closer-to-approval-as-sec-acknowledges-grayscale-filing-is-this-layer-2-sol-project-set-to-soar,https://insidebitcoins.com/wp-content/uploads/2025/02/Solana-ETF_optimized.jpg,InsideBitcoins,SOL
2025-02-07 14:58:00+00:00,"Next Cryptocurrency to Explode, 7 February — Berachain, APENFT, ai16z, TRON","Uncover the next cryptocurrency to explode shortly. Using the latest market data, discover what makes the tokens in our list promising.",https://insidebitcoins.com/news/next-cryptocurrency-to-explode-7-february-berachain-apenft-ai16z-tron,,Inside Bitcoins,
2025-02-07 15:40:00+00:00,Solana Crypto Price Prediction - Is Now the Best Time to Buy $SOL?,"Solana holds steady at $202, despite short-term retracement. Its strong ecosystem, growing adoption, and potential Solana ETF position it well for a rebound.",https://insidebitcoins.com/news/solana-crypto-price-prediction-is-now-the-best-time-to-buy-sol,https://insidebitcoins.com/wp-content/uploads/2025/02/solana-price-prediction.jpg,InsideBitcoins,SOL
2025-02-07 15:51:00+00:00,"Berachain Airdrop Triggers BERA Crash, While Solana Layer 2 Solaxy Shines As SOLX Presale Hits $18.5M","The battle of the protocols is escalating as Berachain launches and Solaxy, the first Solana Layer 2, hits $18.5 million in presale.",https://insidebitcoins.com/news/berachain-airdrop-triggers-bera-crash-while-solana-layer-2-solaxy-shines-as-solx-presale-hits-18-5m,https://insidebitcoins.com/wp-content/uploads/2025/01/solaxy-2.jpg,Inside Bitcoins,SOL
2025-02-07 16:33:00+00:00,SEC Acknowledges Amendment for Grayscale Spot Solana ETF Application,"The US SEC has acknowledged Grayscale's Solana ETF proposal, signaling a potential shift in crypto regulation.",https://cryptonews.com/news/sec-acknowledges-amendment-for-grayscale-spot-solana-etf-application/,https://cimg.co/wp-content/uploads/2025/02/07142714/1738938434-image-1738936186253_optimized.webp,Crypto News,SOL
2025-02-07 16:37:00+00:00,"Solana Price Will More Than Double This Year, Says VanEck—Here's Why","Bitcoin and Ethereum ETF issuer VanEck is bullish on Solana due in part to growing popularity, which has come amid increased stability.",https://decrypt.co/304942/solana-price-surge-520-vaneck,https://cdn.decrypt.co/resize/1024/height/512/wp-content/uploads/2025/01/solana-markets-gID_7.png,decrypt,SOL
2025-02-07 16:39:38+00:00,XRP and Solana race toward the next crypto ETF approval,"Bitcoin and Ethereum got their ETFs, and now Solana and XRP want to be next. But one analyst says Litecoin will come first.",https://www.msn.com/en-us/money/technology/xrp-and-solana-race-toward-the-next-crypto-etf-approval/ar-AA1yBvPo,"https://images.cointelegraph.com/cdn-cgi/image/format=auto,onerror=redirect,quality=90,width=1200/https://s3.cointelegraph.com/uploads/2025-02/0194e145-c3f3-7b3a-ab5d-a51cb2550507",Cointelegraph.com on MSN.com,SOL
2025-02-07 17:55:00+00:00,"Solana (SOL) Primed To Skyrocket 171% This Year, Predict VanEck Analysts - Here's Why","Ethereum (ETH) rival Solana (SOL) could skyrocket to $520 by the end of 2025, according to analysts at the asset management firm VanEck.",https://dailyhodl.com/2025/02/07/solana-sol-primed-to-skyrocket-171-this-year-predict-vaneck-analysts-heres-why/,https://dailyhodl.com/wp-content/uploads/2025/02/sol-primed-this-year.jpg,The Daily Hodl,SOL
2025-02-07 18:30:00+00:00,Will Solana ETFs Join Bitcoin and Ethereum? Experts Say SEC Just Entered 'New Territory',"The SEC acknowledged an application for a spot Solana ETF on Thursday, signaling that the agency's framework for crypto products may shift.",https://decrypt.co/305039/sec-new-territory-solana-etf-nod,https://cdn.decrypt.co/resize/1024/height/512/wp-content/uploads/2023/12/solana-sol-coin-gID_7.jpg,decrypt,SOL
2025-02-07 19:00:00+00:00,Solana Price Prediction: Why Solana Could Fall to $100 in February as Panshibi Set to Rise 100x if Coinbase Listing Happens,"With a bullish market on the horizon, SHIBI has the potential to mirror the success of meme coins like Shiba Inu.",https://www.coinspeaker.com/solana-price-prediction-solana-could-fall-100-february-panshibi-rise-100x/,,Coinspeaker,SOL
2025-02-07 19:36:00+00:00,Hawk Tuah girl reveals her 'biggest mistake' after cryptocurrency scandal,"The internet sensation, also known as Haliey Welch, has addressed her cryptocurrency controversy in a 'leaked' podcast episode and declared how bad she feels for those who invested",https://www.msn.com/en-gb/entertainment/celebrities/hawk-tuah-girl-reveals-her-biggest-mistake-after-cryptocurrency-scandal/ar-AA1yC590,https://img-s-msn-com.akamaized.net/tenant/amp/entityid/AA1yC9BR.img?w=810&h=539&m=4&q=79,MSN,
2025-02-07 21:45:00+00:00,Lebanon man sentenced to 20 years for stealing $37 million in cryptocurrency,"A 21-year-old from Lebanon, Indiana, will serve 20 years in federal prison for his involvement in stealing $37 million in cryptocurrency.",https://www.usatoday.com/story/news/crime/2025/02/07/lebanon-sentenced-20-years-cyber-crime-evan-frederick-light-37-million-crypto-currency-south-dakota/78339785007/,,USA Today,
2025-02-07 21:49:00+00:00,Dave Portnoy Is Trading Solana Meme Coins and Just Doxxed His Wallet: 'I'm Not Trying to Be Shady',"Barstool Sports founder Dave Portnoy is in the trenches with Solana meme coin degens, and just milked them for close to $70K in profit.",https://decrypt.co/305073/dave-portnoy-solana-meme-coins-doxxed-wallet,https://cdn.decrypt.co/resize/1024/height/512/wp-content/uploads/2020/08/portnoy-aug17-gID_7.png,decrypt,SOL
2025-02-08 01:00:00+00:00,Solana (SOL) Price Drops 17% in a Week as It Struggles Below $200,"SOL price falls 17%, struggling near $200 as bearish momentum dominates. A breakout above resistance could trigger a recovery.",https://beincrypto.com/solana-price-bearish-struggles-below-200/,,BeInCrypto,SOL
2025-02-08 11:46:00+00:00,"Solana Price Prediction: As SEC Opens Comments On Grayscale Solana ETF, This SOL Layer-2 ICO Passes $18.6M",The Solana price rose 1% in the past 24 hours as this new SOL layer 2 surges past $18.7 million in its presale.,https://insidebitcoins.com/news/solana-price-prediction-as-sec-opens-comments-on-grayscale-solana-etf-this-sol-layer-2-ico-passes-18-6m,,InsideBitcoins,SOL
2025-02-08 14:15:00+00:00,Solana News: $300 By 2026 Says Quant But 1Fuel Exchange Is The One To Watch This Year,"Solana (SOL) has been declining lately, shocking investors with a major decrease since the start of the year. But some Quant analysts are still predicting that SOL would hit the $300 level by 2026. Even with this high prediction,",https://www.msn.com/en-us/technology/cryptocurrencies/solana-news-300-by-2026-says-quant-but-1fuel-exchange-is-the-one-to-watch-this-year/ar-AA1yEyGi,https://img-s-msn-com.akamaized.net/tenant/amp/entityid/AA1yEAnv.img?w=1600&h=897&m=4&q=93,MSN,SOL
2025-02-08 14:28:00+00:00,"Kaanch Network: The Next Solana & Ethereum Killer with the Potential to Turn $1,500 into $1 Million","Kaanch Network, a next-generation Layer 1 blockchain, is redefining the future of decentralized technology with its industry-leading 1.4 million transactions per second (TPS), 3600 active validators,",https://techbullion.com/kaanch-network-the-next-solana-ethereum-killer-with-the-potential-to-turn-1500-into-1-million/,https://techbullion.com/wp-content/uploads/2025/02/Kaanch-Network-1000x600.jpg,TechBullion,SOL
2025-02-08 16:31:00+00:00,Why This ETF Issuer Won't Touch Dogecoin Amid Solana and XRP Fund Plans,"Canary Capital CEO Steven McClurg said his firm has no plans to offer a Dogecoin ETF, despite expectations of potential approvals this year.",https://decrypt.co/305106/why-etf-issuer-canary-capital-wont-touch-dogecoin,https://cdn.decrypt.co/resize/1024/height/512/wp-content/uploads/2023/05/dogecoin-doge-token-digital-rendering-gID_7.jpg,Decrypt,SOL
2025-02-08 17:55:00+00:00,"SEC Acknowledges Grayscale's Solana ETF Filing, Hinting at Potential Regulatory Sea Change",The U.S. Securities and Exchange Commission (SEC) is acknowledging crypto asset management firm Grayscale's bid to create an exchange-traded fund (ETF) for the smart contract platform Solana (SOL).,https://dailyhodl.com/2025/02/08/sec-acknowledges-grayscales-solana-etf-filing-hinting-at-potential-regulatory-sea-change/,,The Daily Hodl,SOL
2025-02-09 01:18:17+00:00,Emerging Cryptos to Buy: Qubetics Aims for $15 Post-Mainnet While Solana's Speed Impresses and Cosmos Expands Developer Ecosystem,"Discover emerging cryptos to buy. Qubetics targets $15 post-mainnet with massive ROI, Solana maintains lightning-fast transactions, and Cosmos attracts top developers.",https://www.msn.com/en-us/money/markets/emerging-cryptos-to-buy-qubetics-aims-for-15-post-mainnet-while-solana-s-speed-impresses-and-cosmos-expands-developer-ecosystem/ar-AA1yFM6L,https://img-s-msn-com.akamaized.net/tenant/amp/entityid/AA1yFHk3.img?w=1200&h=675&m=4&q=100,Week99er on MSN.com,SOL
2025-02-09 09:41:00+00:00,Solana Price Prediction: SOL Surges 4% As Experts Say Consider This New Solana Layer 2 ICO For 10X Gains,The Solana price surged 4% in the past 24 hours as experts say consider this new Solana Layer 2 ICO for 10X gains.,https://insidebitcoins.com/news/solana-price-prediction-sol-surges-4-as-experts-say-consider-this-new-solana-layer-2-ico-for-10x-gains,,InsideBitcoins,SOL
2025-02-09 10:00:00+00:00,"Solana (SOL) Reaches $200, While Mutuum Finance is Set to Achieve $4 by 2025","Mutuum Finance is gaining momentum in the decentralized finance (DeFi) space. With its token currently available at a low entry price during the presale phase, Mutuum Finance offers early investors a chance to participate in a project poised for significant growth.",https://blockonomi.com/solana-sol-reaches-200-while-mutuum-finance-is-set-to-achieve-4-by-2025/,,Blockonomi,SOL
2025-02-09 10:30:00+00:00,Better Cryptocurrency to Buy Now and Hold Forever: XRP vs. Bitcoin,Forever is a long time to hold a coin. XRP might eventually be supplanted by other payment processors. Bitcoin will probably continue to become scarcer and more valuable. So which of these giants is ripe for a place in your portfolio for the rest of your investing career?,https://www.fool.com/investing/2025/02/09/better-cryptocurrency-to-buy-now-and-hold-forever/,https://g.foolcdn.com/editorial/images/806624/two-older-investors-smile-while-looking-at-papers.jpg,The Motley Fool,
2025-02-09 10:40:00+00:00,"💎 While Solana & Cardano Take a Hit, Agent AI Proves It's the Ultimate Power Play!","The crypto scene is buzzing with change. While Solana and Cardano face challenges, a new player catches the eye. A fresh meme coin, Agent AI, promises not",https://www.cryptopolitan.com/💎-while-solana-cardano-take-a-hit-agent-ai-proves-its-the-ultimate-power-play/,,Cryptopolitan,SOL
